python/sglang/srt/layers/quantization/configs/N=128,K=7168,device_name=NVIDIA_L40S,dtype=fp8_w8a8,block_shape=[64, 64].json
{
    "2048": {
        "BLOCK_SIZE_M": 32,
        "BLOCK_SIZE_N": 64,
        "BLOCK_SIZE_K": 64,
        "GROUP_SIZE_M": 32,
        "num_warps": 4,
        "num_stages": 3
    },
    "3072": {
        "BLOCK_SIZE_M": 64,
        "BLOCK_SIZE_N": 64,
        "BLOCK_SIZE_K": 64,
        "GROUP_SIZE_M": 64,
        "num_warps": 4,
        "num_stages": 4
    },
    "4096": {
        "BLOCK_SIZE_M": 64,
        "BLOCK_SIZE_N": 64,
        "BLOCK_SIZE_K": 64,
        "GROUP_SIZE_M": 16,
        "num_warps": 4,
        "num_stages": 4
    }
}
