python/sglang/srt/layers/quantization/configs/N=512,K=1024,device_name=NVIDIA_H20,dtype=fp8_w8a8,block_shape=[128, 128].json
{
    "1": {
        "BLOCK_SIZE_M": 64,
        "BLOCK_SIZE_N": 128,
        "BLOCK_SIZE_K": 128,
        "GROUP_SIZE_M": 32,
        "num_warps": 4,
        "num_stages": 3
    },
    "2": {
        "BLOCK_SIZE_M": 16,
        "BLOCK_SIZE_N": 32,
        "BLOCK_SIZE_K": 128,
        "GROUP_SIZE_M": 64,
        "num_warps": 4,
        "num_stages": 2
    },
    "3": {
        "BLOCK_SIZE_M": 64,
        "BLOCK_SIZE_N": 32,
        "BLOCK_SIZE_K": 128,
        "GROUP_SIZE_M": 1,
        "num_warps": 8,
        "num_stages": 4
    },
    "4": {
        "BLOCK_SIZE_M": 64,
        "BLOCK_SIZE_N": 32,
        "BLOCK_SIZE_K": 128,
        "GROUP_SIZE_M": 16,
        "num_warps": 8,
        "num_stages": 4
    },
    "5": {
        "BLOCK_SIZE_M": 64,
        "BLOCK_SIZE_N": 32,
        "BLOCK_SIZE_K": 128,
        "GROUP_SIZE_M": 1,
        "num_warps": 8,
        "num_stages": 3
    },
    "6": {
        "BLOCK_SIZE_M": 64,
        "BLOCK_SIZE_N": 32,
        "BLOCK_SIZE_K": 128,
        "GROUP_SIZE_M": 32,
        "num_warps": 8,
        "num_stages": 4
    },
    "7": {
        "BLOCK_SIZE_M": 64,
        "BLOCK_SIZE_N": 32,
        "BLOCK_SIZE_K": 128,
        "GROUP_SIZE_M": 64,
        "num_warps": 4,
        "num_stages": 3
    },
    "8": {
        "BLOCK_SIZE_M": 64,
        "BLOCK_SIZE_N": 32,
        "BLOCK_SIZE_K": 128,
        "GROUP_SIZE_M": 1,
        "num_warps": 8,
        "num_stages": 3
    },
    "12": {
        "BLOCK_SIZE_M": 64,
        "BLOCK_SIZE_N": 64,
        "BLOCK_SIZE_K": 128,
        "GROUP_SIZE_M": 64,
        "num_warps": 4,
        "num_stages": 5
    },
    "14": {
        "BLOCK_SIZE_M": 64,
        "BLOCK_SIZE_N": 64,
        "BLOCK_SIZE_K": 128,
        "GROUP_SIZE_M": 32,
        "num_warps": 4,
        "num_stages": 4
    },
    "16": {
        "BLOCK_SIZE_M": 64,
        "BLOCK_SIZE_N": 64,
        "BLOCK_SIZE_K": 128,
        "GROUP_SIZE_M": 32,
        "num_warps": 4,
        "num_stages": 4
    },
    "24": {
        "BLOCK_SIZE_M": 64,
        "BLOCK_SIZE_N": 64,
        "BLOCK_SIZE_K": 128,
        "GROUP_SIZE_M": 1,
        "num_warps": 8,
        "num_stages": 2
    },
    "32": {
        "BLOCK_SIZE_M": 128,
        "BLOCK_SIZE_N": 32,
        "BLOCK_SIZE_K": 128,
        "GROUP_SIZE_M": 1,
        "num_warps": 4,
        "num_stages": 4
    },
    "48": {
        "BLOCK_SIZE_M": 128,
        "BLOCK_SIZE_N": 32,
        "BLOCK_SIZE_K": 128,
        "GROUP_SIZE_M": 1,
        "num_warps": 4,
        "num_stages": 5
    },
    "64": {
        "BLOCK_SIZE_M": 64,
        "BLOCK_SIZE_N": 32,
        "BLOCK_SIZE_K": 128,
        "GROUP_SIZE_M": 64,
        "num_warps": 8,
        "num_stages": 4
    },
    "96": {
        "BLOCK_SIZE_M": 64,
        "BLOCK_SIZE_N": 128,
        "BLOCK_SIZE_K": 128,
        "GROUP_SIZE_M": 32,
        "num_warps": 4,
        "num_stages": 3
    },
    "128": {
        "BLOCK_SIZE_M": 64,
        "BLOCK_SIZE_N": 64,
        "BLOCK_SIZE_K": 128,
        "GROUP_SIZE_M": 32,
        "num_warps": 4,
        "num_stages": 3
    },
    "256": {
        "BLOCK_SIZE_M": 64,
        "BLOCK_SIZE_N": 32,
        "BLOCK_SIZE_K": 128,
        "GROUP_SIZE_M": 1,
        "num_warps": 8,
        "num_stages": 4
    },
    "512": {
        "BLOCK_SIZE_M": 64,
        "BLOCK_SIZE_N": 128,
        "BLOCK_SIZE_K": 128,
        "GROUP_SIZE_M": 32,
        "num_warps": 4,
        "num_stages": 3
    },
    "1024": {
        "BLOCK_SIZE_M": 64,
        "BLOCK_SIZE_N": 64,
        "BLOCK_SIZE_K": 128,
        "GROUP_SIZE_M": 1,
        "num_warps": 4,
        "num_stages": 2
    },
    "2048": {
        "BLOCK_SIZE_M": 64,
        "BLOCK_SIZE_N": 128,
        "BLOCK_SIZE_K": 128,
        "GROUP_SIZE_M": 64,
        "num_warps": 4,
        "num_stages": 4
    },
    "4096": {
        "BLOCK_SIZE_M": 64,
        "BLOCK_SIZE_N": 128,
        "BLOCK_SIZE_K": 128,
        "GROUP_SIZE_M": 32,
        "num_warps": 4,
        "num_stages": 3
    },
    "8192": {
        "BLOCK_SIZE_M": 64,
        "BLOCK_SIZE_N": 128,
        "BLOCK_SIZE_K": 128,
        "GROUP_SIZE_M": 32,
        "num_warps": 4,
        "num_stages": 3
    }
}
