python/sglang/srt/layers/quantization/configs/N=7168,K=64,device_name=NVIDIA_L20,dtype=fp8_w8a8,block_shape=[64, 64].json
{
    "1": {
        "BLOCK_SIZE_M": 128,
        "BLOCK_SIZE_N": 128,
        "BLOCK_SIZE_K": 64,
        "GROUP_SIZE_M": 1,
        "num_warps": 8,
        "num_stages": 4
    },
    "2": {
        "BLOCK_SIZE_M": 32,
        "BLOCK_SIZE_N": 128,
        "BLOCK_SIZE_K": 64,
        "GROUP_SIZE_M": 32,
        "num_warps": 8,
        "num_stages": 4
    },
    "4": {
        "BLOCK_SIZE_M": 128,
        "BLOCK_SIZE_N": 64,
        "BLOCK_SIZE_K": 64,
        "GROUP_SIZE_M": 1,
        "num_warps": 8,
        "num_stages": 5
    },
    "8": {
        "BLOCK_SIZE_M": 128,
        "BLOCK_SIZE_N": 64,
        "BLOCK_SIZE_K": 64,
        "GROUP_SIZE_M": 16,
        "num_warps": 8,
        "num_stages": 3
    }
}
