python/sglang/srt/layers/moe/fused_moe_triton/configs/triton_3_4_0/E=384,N=256,device_name=AMD_Instinct_MI350X,dtype=int4_w4a16_down.json
{
    "1": {
        "BLOCK_SIZE_M": 16,
        "BLOCK_SIZE_N": 32,
        "BLOCK_SIZE_K": 32,
        "GROUP_SIZE_M": 1,
        "num_warps": 1,
        "num_stages": 2,
        "waves_per_eu": 0,
        "USE_TMA": false
    },
    "2": {
        "BLOCK_SIZE_M": 16,
        "BLOCK_SIZE_N": 32,
        "BLOCK_SIZE_K": 32,
        "GROUP_SIZE_M": 1,
        "num_warps": 1,
        "num_stages": 1,
        "waves_per_eu": 0,
        "USE_TMA": false
    },
    "4": {
        "BLOCK_SIZE_M": 16,
        "BLOCK_SIZE_N": 32,
        "BLOCK_SIZE_K": 32,
        "GROUP_SIZE_M": 1,
        "num_warps": 1,
        "num_stages": 1,
        "waves_per_eu": 0,
        "USE_TMA": false
    },
    "8": {
        "BLOCK_SIZE_M": 16,
        "BLOCK_SIZE_N": 32,
        "BLOCK_SIZE_K": 32,
        "GROUP_SIZE_M": 1,
        "num_warps": 1,
        "num_stages": 2,
        "waves_per_eu": 0,
        "USE_TMA": false
    },
    "16": {
        "BLOCK_SIZE_M": 16,
        "BLOCK_SIZE_N": 32,
        "BLOCK_SIZE_K": 32,
        "GROUP_SIZE_M": 1,
        "num_warps": 1,
        "num_stages": 2,
        "waves_per_eu": 0,
        "USE_TMA": false
    },
    "24": {
        "BLOCK_SIZE_M": 16,
        "BLOCK_SIZE_N": 128,
        "BLOCK_SIZE_K": 32,
        "GROUP_SIZE_M": 4,
        "num_warps": 4,
        "num_stages": 2,
        "waves_per_eu": 0,
        "USE_TMA": false
    },
    "32": {
        "BLOCK_SIZE_M": 16,
        "BLOCK_SIZE_N": 128,
        "BLOCK_SIZE_K": 32,
        "GROUP_SIZE_M": 4,
        "num_warps": 4,
        "num_stages": 2,
        "waves_per_eu": 0,
        "USE_TMA": false
    },
    "48": {
        "BLOCK_SIZE_M": 16,
        "BLOCK_SIZE_N": 64,
        "BLOCK_SIZE_K": 32,
        "GROUP_SIZE_M": 8,
        "num_warps": 1,
        "num_stages": 2,
        "waves_per_eu": 0,
        "USE_TMA": false
    },
    "64": {
        "BLOCK_SIZE_M": 16,
        "BLOCK_SIZE_N": 64,
        "BLOCK_SIZE_K": 32,
        "GROUP_SIZE_M": 8,
        "num_warps": 1,
        "num_stages": 2,
        "waves_per_eu": 0,
        "USE_TMA": false
    },
    "96": {
        "BLOCK_SIZE_M": 16,
        "BLOCK_SIZE_N": 64,
        "BLOCK_SIZE_K": 32,
        "GROUP_SIZE_M": 1,
        "num_warps": 1,
        "num_stages": 2,
        "waves_per_eu": 0,
        "USE_TMA": false
    },
    "128": {
        "BLOCK_SIZE_M": 16,
        "BLOCK_SIZE_N": 64,
        "BLOCK_SIZE_K": 32,
        "GROUP_SIZE_M": 1,
        "num_warps": 1,
        "num_stages": 2,
        "waves_per_eu": 0,
        "USE_TMA": false
    },
    "256": {
        "BLOCK_SIZE_M": 16,
        "BLOCK_SIZE_N": 64,
        "BLOCK_SIZE_K": 32,
        "GROUP_SIZE_M": 1,
        "num_warps": 1,
        "num_stages": 2,
        "waves_per_eu": 0,
        "USE_TMA": false
    },
    "512": {
        "BLOCK_SIZE_M": 64,
        "BLOCK_SIZE_N": 128,
        "BLOCK_SIZE_K": 32,
        "GROUP_SIZE_M": 4,
        "num_warps": 4,
        "num_stages": 2,
        "waves_per_eu": 0,
        "USE_TMA": false
    },
    "1024": {
        "BLOCK_SIZE_M": 128,
        "BLOCK_SIZE_N": 256,
        "BLOCK_SIZE_K": 32,
        "GROUP_SIZE_M": 1,
        "num_warps": 8,
        "num_stages": 1,
        "waves_per_eu": 0,
        "USE_TMA": false
    },
    "1536": {
        "BLOCK_SIZE_M": 128,
        "BLOCK_SIZE_N": 256,
        "BLOCK_SIZE_K": 32,
        "GROUP_SIZE_M": 1,
        "num_warps": 8,
        "num_stages": 1,
        "waves_per_eu": 0,
        "USE_TMA": false
    },
    "2048": {
        "BLOCK_SIZE_M": 128,
        "BLOCK_SIZE_N": 256,
        "BLOCK_SIZE_K": 32,
        "GROUP_SIZE_M": 4,
        "num_warps": 8,
        "num_stages": 1,
        "waves_per_eu": 0,
        "USE_TMA": false
    },
    "3072": {
        "BLOCK_SIZE_M": 128,
        "BLOCK_SIZE_N": 256,
        "BLOCK_SIZE_K": 32,
        "GROUP_SIZE_M": 4,
        "num_warps": 8,
        "num_stages": 1,
        "waves_per_eu": 0,
        "USE_TMA": false
    },
    "4096": {
        "BLOCK_SIZE_M": 128,
        "BLOCK_SIZE_N": 256,
        "BLOCK_SIZE_K": 32,
        "GROUP_SIZE_M": 4,
        "num_warps": 8,
        "num_stages": 1,
        "waves_per_eu": 0,
        "USE_TMA": false
    }
}
