python/sglang/srt/layers/moe/moe_runner/triton_utils/configs/minimax_m3_gfx950_mxfp8_compact_moe.json
{
  "model": "MiniMax-M3",
  "device": "gfx950",
  "experts": 128,
  "hidden_size": 6144,
  "intermediate_size": 384,
  "top_k": 4,
  "tokens": {
    "1": {
      "best_gemm1": {"block_m": 128, "block_n": 256, "block_k": 128, "num_stages": 1, "num_warps": 4},
      "best_gemm2": {"block_m": 128, "block_n": 256, "block_k": 128, "num_stages": 1, "num_warps": 4}
    },
    "2": {
      "best_gemm1": {"block_m": 64, "block_n": 128, "block_k": 128, "num_stages": 2, "num_warps": 8},
      "best_gemm2": {"block_m": 64, "block_n": 256, "block_k": 128, "num_stages": 2, "num_warps": 4}
    },
    "4": {
      "best_gemm1": {"block_m": 128, "block_n": 256, "block_k": 128, "num_stages": 1, "num_warps": 4},
      "best_gemm2": {"block_m": 128, "block_n": 128, "block_k": 64, "num_stages": 1, "num_warps": 4}
    },
    "8": {
      "best_gemm1": {"block_m": 128, "block_n": 128, "block_k": 256, "num_stages": 1, "num_warps": 4},
      "best_gemm2": {"block_m": 128, "block_n": 256, "block_k": 128, "num_stages": 2, "num_warps": 8}
    },
    "16": {
      "best_gemm1": {"block_m": 64, "block_n": 128, "block_k": 256, "num_stages": 2, "num_warps": 8},
      "best_gemm2": {"block_m": 64, "block_n": 256, "block_k": 128, "num_stages": 2, "num_warps": 4}
    },
    "32": {
      "best_gemm1": {"block_m": 64, "block_n": 128, "block_k": 128, "num_stages": 2, "num_warps": 8},
      "best_gemm2": {"block_m": 64, "block_n": 128, "block_k": 64, "num_stages": 2, "num_warps": 4}
    },
    "64": {
      "best_gemm1": {"block_m": 32, "block_n": 256, "block_k": 128, "num_stages": 1, "num_warps": 4},
      "best_gemm2": {"block_m": 32, "block_n": 256, "block_k": 128, "num_stages": 1, "num_warps": 4}
    },
    "128": {
      "best_gemm1": {"block_m": 64, "block_n": 256, "block_k": 256, "num_stages": 1, "num_warps": 4},
      "best_gemm2": {"block_m": 32, "block_n": 256, "block_k": 128, "num_stages": 1, "num_warps": 8}
    },
    "256": {
      "best_gemm1": {"block_m": 32, "block_n": 128, "block_k": 256, "num_stages": 1, "num_warps": 4},
      "best_gemm2": {"block_m": 32, "block_n": 256, "block_k": 128, "num_stages": 1, "num_warps": 8}
    },
    "512": {
      "best_gemm1": {"block_m": 64, "block_n": 128, "block_k": 256, "num_stages": 1, "num_warps": 4},
      "best_gemm2": {"block_m": 32, "block_n": 256, "block_k": 128, "num_stages": 1, "num_warps": 8}
    },
    "1024": {
      "best_gemm1": {"block_m": 64, "block_n": 128, "block_k": 256, "num_stages": 2, "num_warps": 8},
      "best_gemm2": {"block_m": 64, "block_n": 256, "block_k": 128, "num_stages": 1, "num_warps": 8}
    },
    "1536": {
      "best_gemm1": {"block_m": 64, "block_n": 128, "block_k": 256, "num_stages": 2, "num_warps": 8},
      "best_gemm2": {"block_m": 64, "block_n": 128, "block_k": 128, "num_stages": 1, "num_warps": 4}
    },
    "2048": {
      "best_gemm1": {"block_m": 128, "block_n": 128, "block_k": 256, "num_stages": 2, "num_warps": 8},
      "best_gemm2": {"block_m": 128, "block_n": 128, "block_k": 128, "num_stages": 2, "num_warps": 8}
    },
    "3072": {
      "best_gemm1": {"block_m": 128, "block_n": 256, "block_k": 128, "num_stages": 1, "num_warps": 4},
      "best_gemm2": {"block_m": 128, "block_n": 256, "block_k": 128, "num_stages": 1, "num_warps": 4}
    },
    "4096": {
      "best_gemm1": {"block_m": 128, "block_n": 256, "block_k": 128, "num_stages": 1, "num_warps": 4},
      "best_gemm2": {"block_m": 128, "block_n": 256, "block_k": 128, "num_stages": 1, "num_warps": 4}
    }
  }
}
