python/sglang/srt/layers/moe/moe_runner/triton_utils/configs/triton_3_4_0/E=257,N=256,device_name=NVIDIA_H20,dtype=fp8_w8a8,block_shape=[128, 128]_down.json
{
    "1": {
        "BLOCK_SIZE_M": 16,
        "BLOCK_SIZE_N": 128,
        "BLOCK_SIZE_K": 128,
        "GROUP_SIZE_M": 1,
        "num_warps": 4,
        "num_stages": 3,
        "USE_TMA": false
    },
    "2": {
        "BLOCK_SIZE_M": 16,
        "BLOCK_SIZE_N": 64,
        "BLOCK_SIZE_K": 64,
        "GROUP_SIZE_M": 1,
        "num_warps": 8,
        "num_stages": 5,
        "USE_TMA": false
    },
    "4": {
        "BLOCK_SIZE_M": 16,
        "BLOCK_SIZE_N": 64,
        "BLOCK_SIZE_K": 64,
        "GROUP_SIZE_M": 16,
        "num_warps": 4,
        "num_stages": 3,
        "USE_TMA": false
    },
    "8": {
        "BLOCK_SIZE_M": 16,
        "BLOCK_SIZE_N": 128,
        "BLOCK_SIZE_K": 128,
        "GROUP_SIZE_M": 16,
        "num_warps": 4,
        "num_stages": 2,
        "USE_TMA": false
    },
    "16": {
        "BLOCK_SIZE_M": 16,
        "BLOCK_SIZE_N": 128,
        "BLOCK_SIZE_K": 64,
        "GROUP_SIZE_M": 1,
        "num_warps": 4,
        "num_stages": 4,
        "USE_TMA": false
    },
    "24": {
        "BLOCK_SIZE_M": 16,
        "BLOCK_SIZE_N": 128,
        "BLOCK_SIZE_K": 64,
        "GROUP_SIZE_M": 32,
        "num_warps": 4,
        "num_stages": 3,
        "USE_TMA": false
    },
    "32": {
        "BLOCK_SIZE_M": 16,
        "BLOCK_SIZE_N": 128,
        "BLOCK_SIZE_K": 64,
        "GROUP_SIZE_M": 16,
        "num_warps": 4,
        "num_stages": 5,
        "USE_TMA": false
    },
    "48": {
        "BLOCK_SIZE_M": 16,
        "BLOCK_SIZE_N": 128,
        "BLOCK_SIZE_K": 64,
        "GROUP_SIZE_M": 16,
        "num_warps": 4,
        "num_stages": 4,
        "USE_TMA": false
    },
    "64": {
        "BLOCK_SIZE_M": 16,
        "BLOCK_SIZE_N": 128,
        "BLOCK_SIZE_K": 64,
        "GROUP_SIZE_M": 32,
        "num_warps": 4,
        "num_stages": 3,
        "USE_TMA": false
    },
    "96": {
        "BLOCK_SIZE_M": 16,
        "BLOCK_SIZE_N": 128,
        "BLOCK_SIZE_K": 64,
        "GROUP_SIZE_M": 1,
        "num_warps": 4,
        "num_stages": 3,
        "USE_TMA": false
    },
    "128": {
        "BLOCK_SIZE_M": 16,
        "BLOCK_SIZE_N": 128,
        "BLOCK_SIZE_K": 64,
        "GROUP_SIZE_M": 1,
        "num_warps": 4,
        "num_stages": 3,
        "USE_TMA": false
    },
    "256": {
        "BLOCK_SIZE_M": 16,
        "BLOCK_SIZE_N": 128,
        "BLOCK_SIZE_K": 128,
        "GROUP_SIZE_M": 64,
        "num_warps": 4,
        "num_stages": 3,
        "USE_TMA": true
    },
    "512": {
        "BLOCK_SIZE_M": 64,
        "BLOCK_SIZE_N": 128,
        "BLOCK_SIZE_K": 128,
        "GROUP_SIZE_M": 16,
        "num_warps": 4,
        "num_stages": 3,
        "USE_TMA": true
    },
    "1024": {
        "BLOCK_SIZE_M": 64,
        "BLOCK_SIZE_N": 128,
        "BLOCK_SIZE_K": 128,
        "GROUP_SIZE_M": 16,
        "num_warps": 4,
        "num_stages": 3,
        "USE_TMA": true
    },
    "1536": {
        "BLOCK_SIZE_M": 64,
        "BLOCK_SIZE_N": 128,
        "BLOCK_SIZE_K": 128,
        "GROUP_SIZE_M": 64,
        "num_warps": 4,
        "num_stages": 3,
        "USE_TMA": true
    },
    "2048": {
        "BLOCK_SIZE_M": 64,
        "BLOCK_SIZE_N": 128,
        "BLOCK_SIZE_K": 128,
        "GROUP_SIZE_M": 32,
        "num_warps": 4,
        "num_stages": 3,
        "USE_TMA": true
    },
    "3072": {
        "BLOCK_SIZE_M": 64,
        "BLOCK_SIZE_N": 128,
        "BLOCK_SIZE_K": 128,
        "GROUP_SIZE_M": 16,
        "num_warps": 4,
        "num_stages": 3,
        "USE_TMA": true
    },
    "4096": {
        "BLOCK_SIZE_M": 64,
        "BLOCK_SIZE_N": 128,
        "BLOCK_SIZE_K": 128,
        "GROUP_SIZE_M": 16,
        "num_warps": 4,
        "num_stages": 3,
        "USE_TMA": true
    }
}
