python/sglang/kernels/ops/gemm/csgmv_configs/triton_3_5_1/lora_shrink,K=2048,R=64,S=1,device=NVIDIA_H200.json
{
    "16": {
        "BLOCK_N": 64,
        "BLOCK_K": 128,
        "num_warps": 4,
        "num_stages": 3
    },
    "32": {
        "BLOCK_N": 64,
        "BLOCK_K": 64,
        "num_warps": 4,
        "num_stages": 3
    },
    "64": {
        "BLOCK_N": 64,
        "BLOCK_K": 64,
        "num_warps": 4,
        "num_stages": 3
    },
    "128": {
        "BLOCK_N": 64,
        "BLOCK_K": 64,
        "num_warps": 8,
        "num_stages": 4
    }
}
