python/sglang/kernels/ops/gemm/csgmv_configs/triton_3_5_1/lora_expand,K=1024,R=64,S=1,device=NVIDIA_H200.json
{
    "16": {
        "BLOCK_N": 64,
        "BLOCK_K": 32,
        "num_warps": 4,
        "num_stages": 1,
        "maxnreg": 128
    },
    "32": {
        "BLOCK_N": 64,
        "BLOCK_K": 32,
        "num_warps": 4,
        "num_stages": 2
    },
    "64": {
        "BLOCK_N": 64,
        "BLOCK_K": 32,
        "num_warps": 4,
        "num_stages": 2,
        "maxnreg": 160
    },
    "128": {
        "BLOCK_N": 64,
        "BLOCK_K": 16,
        "num_warps": 8,
        "num_stages": 2,
        "maxnreg": 128
    }
}
