python/sglang/srt/lora/triton_ops/csgmv_configs/triton_3_5_1/lora_expand,K=4096,R=64,S=3,device=NVIDIA_H200.json
{
    "16": {
        "BLOCK_N": 64,
        "BLOCK_K": 32,
        "num_warps": 4,
        "num_stages": 3,
        "maxnreg": 160
    },
    "32": {
        "BLOCK_N": 64,
        "BLOCK_K": 32,
        "num_warps": 4,
        "num_stages": 3
    },
    "64": {
        "BLOCK_N": 64,
        "BLOCK_K": 32,
        "num_warps": 4,
        "num_stages": 1,
        "maxnreg": 160
    },
    "128": {
        "BLOCK_N": 64,
        "BLOCK_K": 16,
        "num_warps": 8,
        "num_stages": 2,
        "maxnreg": 128
    }
}
