benchmark/kernels/triton_opt/prefill_attention/results.json
[
  {
    "config": "w4_s1_m64_n64",
    "num_warps": 4,
    "num_stages": 1,
    "BLOCK_M": 64,
    "BLOCK_N": 64,
    "seq_len": 128,
    "num_heads": 4,
    "head_dim": 64,
    "time_ms": 0.0113
  },
  {
    "config": "w4_s1_m64_n128",
    "num_warps": 4,
    "num_stages": 1,
    "BLOCK_M": 64,
    "BLOCK_N": 128,
    "seq_len": 128,
    "num_heads": 4,
    "head_dim": 64,
    "time_ms": 0.0104
  },
  {
    "config": "w4_s1_m128_n128",
    "num_warps": 4,
    "num_stages": 1,
    "BLOCK_M": 128,
    "BLOCK_N": 128,
    "seq_len": 128,
    "num_heads": 4,
    "head_dim": 64,
    "time_ms": 0.0163
  },
  {
    "config": "w4_s2_m64_n64",
    "num_warps": 4,
    "num_stages": 2,
    "BLOCK_M": 64,
    "BLOCK_N": 64,
    "seq_len": 128,
    "num_heads": 4,
    "head_dim": 64,
    "time_ms": 0.0104
  },
  {
    "config": "w4_s2_m64_n128",
    "num_warps": 4,
    "num_stages": 2,
    "BLOCK_M": 64,
    "BLOCK_N": 128,
    "seq_len": 128,
    "num_heads": 4,
    "head_dim": 64,
    "time_ms": 0.0097
  },
  {
    "config": "w4_s2_m128_n128",
    "num_warps": 4,
    "num_stages": 2,
    "BLOCK_M": 128,
    "BLOCK_N": 128,
    "seq_len": 128,
    "num_heads": 4,
    "head_dim": 64,
    "time_ms": 0.0152
  },
  {
    "config": "w4_s3_m64_n64",
    "num_warps": 4,
    "num_stages": 3,
    "BLOCK_M": 64,
    "BLOCK_N": 64,
    "seq_len": 128,
    "num_heads": 4,
    "head_dim": 64,
    "time_ms": 0.0098
  },
  {
    "config": "w4_s3_m64_n128",
    "num_warps": 4,
    "num_stages": 3,
    "BLOCK_M": 64,
    "BLOCK_N": 128,
    "seq_len": 128,
    "num_heads": 4,
    "head_dim": 64,
    "time_ms": 0.0097
  },
  {
    "config": "w4_s3_m128_n128",
    "num_warps": 4,
    "num_stages": 3,
    "BLOCK_M": 128,
    "BLOCK_N": 128,
    "seq_len": 128,
    "num_heads": 4,
    "head_dim": 64,
    "time_ms": 0.0151
  },
  {
    "config": "w8_s1_m64_n64",
    "num_warps": 8,
    "num_stages": 1,
    "BLOCK_M": 64,
    "BLOCK_N": 64,
    "seq_len": 128,
    "num_heads": 4,
    "head_dim": 64,
    "time_ms": 0.0113
  },
  {
    "config": "w8_s1_m64_n128",
    "num_warps": 8,
    "num_stages": 1,
    "BLOCK_M": 64,
    "BLOCK_N": 128,
    "seq_len": 128,
    "num_heads": 4,
    "head_dim": 64,
    "time_ms": 0.0104
  },
  {
    "config": "w8_s1_m128_n128",
    "num_warps": 8,
    "num_stages": 1,
    "BLOCK_M": 128,
    "BLOCK_N": 128,
    "seq_len": 128,
    "num_heads": 4,
    "head_dim": 64,
    "time_ms": 0.011
  },
  {
    "config": "w8_s2_m64_n64",
    "num_warps": 8,
    "num_stages": 2,
    "BLOCK_M": 64,
    "BLOCK_N": 64,
    "seq_len": 128,
    "num_heads": 4,
    "head_dim": 64,
    "time_ms": 0.0115
  },
  {
    "config": "w8_s2_m64_n128",
    "num_warps": 8,
    "num_stages": 2,
    "BLOCK_M": 64,
    "BLOCK_N": 128,
    "seq_len": 128,
    "num_heads": 4,
    "head_dim": 64,
    "time_ms": 0.0105
  },
  {
    "config": "w8_s2_m128_n128",
    "num_warps": 8,
    "num_stages": 2,
    "BLOCK_M": 128,
    "BLOCK_N": 128,
    "seq_len": 128,
    "num_heads": 4,
    "head_dim": 64,
    "time_ms": 0.0108
  },
  {
    "config": "w8_s3_m64_n64",
    "num_warps": 8,
    "num_stages": 3,
    "BLOCK_M": 64,
    "BLOCK_N": 64,
    "seq_len": 128,
    "num_heads": 4,
    "head_dim": 64,
    "time_ms": 0.011
  },
  {
    "config": "w8_s3_m64_n128",
    "num_warps": 8,
    "num_stages": 3,
    "BLOCK_M": 64,
    "BLOCK_N": 128,
    "seq_len": 128,
    "num_heads": 4,
    "head_dim": 64,
    "time_ms": 0.0105
  },
  {
    "config": "w8_s3_m128_n128",
    "num_warps": 8,
    "num_stages": 3,
    "BLOCK_M": 128,
    "BLOCK_N": 128,
    "seq_len": 128,
    "num_heads": 4,
    "head_dim": 64,
    "time_ms": 0.0108
  },
  {
    "config": "w16_s1_m64_n64",
    "num_warps": 16,
    "num_stages": 1,
    "BLOCK_M": 64,
    "BLOCK_N": 64,
    "seq_len": 128,
    "num_heads": 4,
    "head_dim": 64,
    "time_ms": 0.0136
  },
  {
    "config": "w16_s1_m64_n128",
    "num_warps": 16,
    "num_stages": 1,
    "BLOCK_M": 64,
    "BLOCK_N": 128,
    "seq_len": 128,
    "num_heads": 4,
    "head_dim": 64,
    "time_ms": 0.0135
  },
  {
    "config": "w16_s1_m128_n128",
    "num_warps": 16,
    "num_stages": 1,
    "BLOCK_M": 128,
    "BLOCK_N": 128,
    "seq_len": 128,
    "num_heads": 4,
    "head_dim": 64,
    "time_ms": 0.0128
  },
  {
    "config": "w16_s2_m64_n64",
    "num_warps": 16,
    "num_stages": 2,
    "BLOCK_M": 64,
    "BLOCK_N": 64,
    "seq_len": 128,
    "num_heads": 4,
    "head_dim": 64,
    "time_ms": 0.0142
  },
  {
    "config": "w16_s2_m64_n128",
    "num_warps": 16,
    "num_stages": 2,
    "BLOCK_M": 64,
    "BLOCK_N": 128,
    "seq_len": 128,
    "num_heads": 4,
    "head_dim": 64,
    "time_ms": 0.0124
  },
  {
    "config": "w16_s2_m128_n128",
    "num_warps": 16,
    "num_stages": 2,
    "BLOCK_M": 128,
    "BLOCK_N": 128,
    "seq_len": 128,
    "num_heads": 4,
    "head_dim": 64,
    "time_ms": 0.0131
  },
  {
    "config": "w16_s3_m64_n64",
    "num_warps": 16,
    "num_stages": 3,
    "BLOCK_M": 64,
    "BLOCK_N": 64,
    "seq_len": 128,
    "num_heads": 4,
    "head_dim": 64,
    "time_ms": 0.0137
  },
  {
    "config": "w16_s3_m64_n128",
    "num_warps": 16,
    "num_stages": 3,
    "BLOCK_M": 64,
    "BLOCK_N": 128,
    "seq_len": 128,
    "num_heads": 4,
    "head_dim": 64,
    "time_ms": 0.0124
  },
  {
    "config": "w16_s3_m128_n128",
    "num_warps": 16,
    "num_stages": 3,
    "BLOCK_M": 128,
    "BLOCK_N": 128,
    "seq_len": 128,
    "num_heads": 4,
    "head_dim": 64,
    "time_ms": 0.013
  },
  {
    "config": "w4_s1_m64_n64",
    "num_warps": 4,
    "num_stages": 1,
    "BLOCK_M": 64,
    "BLOCK_N": 64,
    "seq_len": 128,
    "num_heads": 4,
    "head_dim": 128,
    "time_ms": 0.0134
  },
  {
    "config": "w4_s1_m64_n128",
    "num_warps": 4,
    "num_stages": 1,
    "BLOCK_M": 64,
    "BLOCK_N": 128,
    "seq_len": 128,
    "num_heads": 4,
    "head_dim": 128,
    "time_ms": 0.0128
  },
  {
    "config": "w4_s1_m128_n128",
    "num_warps": 4,
    "num_stages": 1,
    "BLOCK_M": 128,
    "BLOCK_N": 128,
    "seq_len": 128,
    "num_heads": 4,
    "head_dim": 128,
    "time_ms": 0.0235
  },
  {
    "config": "w4_s2_m64_n64",
    "num_warps": 4,
    "num_stages": 2,
    "BLOCK_M": 64,
    "BLOCK_N": 64,
    "seq_len": 128,
    "num_heads": 4,
    "head_dim": 128,
    "time_ms": 0.013
  },
  {
    "config": "w4_s2_m64_n128",
    "num_warps": 4,
    "num_stages": 2,
    "BLOCK_M": 64,
    "BLOCK_N": 128,
    "seq_len": 128,
    "num_heads": 4,
    "head_dim": 128,
    "time_ms": 0.0123
  },
  {
    "config": "w4_s2_m128_n128",
    "num_warps": 4,
    "num_stages": 2,
    "BLOCK_M": 128,
    "BLOCK_N": 128,
    "seq_len": 128,
    "num_heads": 4,
    "head_dim": 128,
    "time_ms": 0.0202
  },
  {
    "config": "w4_s3_m64_n64",
    "num_warps": 4,
    "num_stages": 3,
    "BLOCK_M": 64,
    "BLOCK_N": 64,
    "seq_len": 128,
    "num_heads": 4,
    "head_dim": 128,
    "time_ms": 0.0124
  },
  {
    "config": "w4_s3_m64_n128",
    "num_warps": 4,
    "num_stages": 3,
    "BLOCK_M": 64,
    "BLOCK_N": 128,
    "seq_len": 128,
    "num_heads": 4,
    "head_dim": 128,
    "time_ms": 0.0129
  },
  {
    "config": "w4_s3_m128_n128",
    "num_warps": 4,
    "num_stages": 3,
    "BLOCK_M": 128,
    "BLOCK_N": 128,
    "seq_len": 128,
    "num_heads": 4,
    "head_dim": 128,
    "time_ms": 0.0207
  },
  {
    "config": "w8_s1_m64_n64",
    "num_warps": 8,
    "num_stages": 1,
    "BLOCK_M": 64,
    "BLOCK_N": 64,
    "seq_len": 128,
    "num_heads": 4,
    "head_dim": 128,
    "time_ms": 0.0131
  },
  {
    "config": "w8_s1_m64_n128",
    "num_warps": 8,
    "num_stages": 1,
    "BLOCK_M": 64,
    "BLOCK_N": 128,
    "seq_len": 128,
    "num_heads": 4,
    "head_dim": 128,
    "time_ms": 0.0119
  },
  {
    "config": "w8_s1_m128_n128",
    "num_warps": 8,
    "num_stages": 1,
    "BLOCK_M": 128,
    "BLOCK_N": 128,
    "seq_len": 128,
    "num_heads": 4,
    "head_dim": 128,
    "time_ms": 0.0141
  },
  {
    "config": "w8_s2_m64_n64",
    "num_warps": 8,
    "num_stages": 2,
    "BLOCK_M": 64,
    "BLOCK_N": 64,
    "seq_len": 128,
    "num_heads": 4,
    "head_dim": 128,
    "time_ms": 0.013
  },
  {
    "config": "w8_s2_m64_n128",
    "num_warps": 8,
    "num_stages": 2,
    "BLOCK_M": 64,
    "BLOCK_N": 128,
    "seq_len": 128,
    "num_heads": 4,
    "head_dim": 128,
    "time_ms": 0.0117
  },
  {
    "config": "w8_s2_m128_n128",
    "num_warps": 8,
    "num_stages": 2,
    "BLOCK_M": 128,
    "BLOCK_N": 128,
    "seq_len": 128,
    "num_heads": 4,
    "head_dim": 128,
    "time_ms": 0.0142
  },
  {
    "config": "w8_s3_m64_n64",
    "num_warps": 8,
    "num_stages": 3,
    "BLOCK_M": 64,
    "BLOCK_N": 64,
    "seq_len": 128,
    "num_heads": 4,
    "head_dim": 128,
    "time_ms": 0.0123
  },
  {
    "config": "w8_s3_m64_n128",
    "num_warps": 8,
    "num_stages": 3,
    "BLOCK_M": 64,
    "BLOCK_N": 128,
    "seq_len": 128,
    "num_heads": 4,
    "head_dim": 128,
    "time_ms": 0.0117
  },
  {
    "config": "w8_s3_m128_n128",
    "num_warps": 8,
    "num_stages": 3,
    "BLOCK_M": 128,
    "BLOCK_N": 128,
    "seq_len": 128,
    "num_heads": 4,
    "head_dim": 128,
    "time_ms": 0.0143
  },
  {
    "config": "w16_s1_m64_n64",
    "num_warps": 16,
    "num_stages": 1,
    "BLOCK_M": 64,
    "BLOCK_N": 64,
    "seq_len": 128,
    "num_heads": 4,
    "head_dim": 128,
    "time_ms": 0.0161
  },
  {
    "config": "w16_s1_m64_n128",
    "num_warps": 16,
    "num_stages": 1,
    "BLOCK_M": 64,
    "BLOCK_N": 128,
    "seq_len": 128,
    "num_heads": 4,
    "head_dim": 128,
    "time_ms": 0.015
  },
  {
    "config": "w16_s1_m128_n128",
    "num_warps": 16,
    "num_stages": 1,
    "BLOCK_M": 128,
    "BLOCK_N": 128,
    "seq_len": 128,
    "num_heads": 4,
    "head_dim": 128,
    "time_ms": 0.0175
  },
  {
    "config": "w16_s2_m64_n64",
    "num_warps": 16,
    "num_stages": 2,
    "BLOCK_M": 64,
    "BLOCK_N": 64,
    "seq_len": 128,
    "num_heads": 4,
    "head_dim": 128,
    "time_ms": 0.0165
  },
  {
    "config": "w16_s2_m64_n128",
    "num_warps": 16,
    "num_stages": 2,
    "BLOCK_M": 64,
    "BLOCK_N": 128,
    "seq_len": 128,
    "num_heads": 4,
    "head_dim": 128,
    "time_ms": 0.0143
  },
  {
    "config": "w16_s2_m128_n128",
    "num_warps": 16,
    "num_stages": 2,
    "BLOCK_M": 128,
    "BLOCK_N": 128,
    "seq_len": 128,
    "num_heads": 4,
    "head_dim": 128,
    "time_ms": 0.0153
  },
  {
    "config": "w16_s3_m64_n64",
    "num_warps": 16,
    "num_stages": 3,
    "BLOCK_M": 64,
    "BLOCK_N": 64,
    "seq_len": 128,
    "num_heads": 4,
    "head_dim": 128,
    "time_ms": 0.0158
  },
  {
    "config": "w16_s3_m64_n128",
    "num_warps": 16,
    "num_stages": 3,
    "BLOCK_M": 64,
    "BLOCK_N": 128,
    "seq_len": 128,
    "num_heads": 4,
    "head_dim": 128,
    "time_ms": 0.0145
  },
  {
    "config": "w16_s3_m128_n128",
    "num_warps": 16,
    "num_stages": 3,
    "BLOCK_M": 128,
    "BLOCK_N": 128,
    "seq_len": 128,
    "num_heads": 4,
    "head_dim": 128,
    "time_ms": 0.0155
  },
  {
    "config": "w4_s1_m64_n64",
    "num_warps": 4,
    "num_stages": 1,
    "BLOCK_M": 64,
    "BLOCK_N": 64,
    "seq_len": 128,
    "num_heads": 32,
    "head_dim": 64,
    "time_ms": 0.0132
  },
  {
    "config": "w4_s1_m64_n128",
    "num_warps": 4,
    "num_stages": 1,
    "BLOCK_M": 64,
    "BLOCK_N": 128,
    "seq_len": 128,
    "num_heads": 32,
    "head_dim": 64,
    "time_ms": 0.0122
  },
  {
    "config": "w4_s1_m128_n128",
    "num_warps": 4,
    "num_stages": 1,
    "BLOCK_M": 128,
    "BLOCK_N": 128,
    "seq_len": 128,
    "num_heads": 32,
    "head_dim": 64,
    "time_ms": 0.0183
  },
  {
    "config": "w4_s2_m64_n64",
    "num_warps": 4,
    "num_stages": 2,
    "BLOCK_M": 64,
    "BLOCK_N": 64,
    "seq_len": 128,
    "num_heads": 32,
    "head_dim": 64,
    "time_ms": 0.0122
  },
  {
    "config": "w4_s2_m64_n128",
    "num_warps": 4,
    "num_stages": 2,
    "BLOCK_M": 64,
    "BLOCK_N": 128,
    "seq_len": 128,
    "num_heads": 32,
    "head_dim": 64,
    "time_ms": 0.0114
  },
  {
    "config": "w4_s2_m128_n128",
    "num_warps": 4,
    "num_stages": 2,
    "BLOCK_M": 128,
    "BLOCK_N": 128,
    "seq_len": 128,
    "num_heads": 32,
    "head_dim": 64,
    "time_ms": 0.0171
  },
  {
    "config": "w4_s3_m64_n64",
    "num_warps": 4,
    "num_stages": 3,
    "BLOCK_M": 64,
    "BLOCK_N": 64,
    "seq_len": 128,
    "num_heads": 32,
    "head_dim": 64,
    "time_ms": 0.0114
  },
  {
    "config": "w4_s3_m64_n128",
    "num_warps": 4,
    "num_stages": 3,
    "BLOCK_M": 64,
    "BLOCK_N": 128,
    "seq_len": 128,
    "num_heads": 32,
    "head_dim": 64,
    "time_ms": 0.0114
  },
  {
    "config": "w4_s3_m128_n128",
    "num_warps": 4,
    "num_stages": 3,
    "BLOCK_M": 128,
    "BLOCK_N": 128,
    "seq_len": 128,
    "num_heads": 32,
    "head_dim": 64,
    "time_ms": 0.017
  },
  {
    "config": "w8_s1_m64_n64",
    "num_warps": 8,
    "num_stages": 1,
    "BLOCK_M": 64,
    "BLOCK_N": 64,
    "seq_len": 128,
    "num_heads": 32,
    "head_dim": 64,
    "time_ms": 0.0129
  },
  {
    "config": "w8_s1_m64_n128",
    "num_warps": 8,
    "num_stages": 1,
    "BLOCK_M": 64,
    "BLOCK_N": 128,
    "seq_len": 128,
    "num_heads": 32,
    "head_dim": 64,
    "time_ms": 0.0121
  },
  {
    "config": "w8_s1_m128_n128",
    "num_warps": 8,
    "num_stages": 1,
    "BLOCK_M": 128,
    "BLOCK_N": 128,
    "seq_len": 128,
    "num_heads": 32,
    "head_dim": 64,
    "time_ms": 0.0127
  },
  {
    "config": "w8_s2_m64_n64",
    "num_warps": 8,
    "num_stages": 2,
    "BLOCK_M": 64,
    "BLOCK_N": 64,
    "seq_len": 128,
    "num_heads": 32,
    "head_dim": 64,
    "time_ms": 0.0132
  },
  {
    "config": "w8_s2_m64_n128",
    "num_warps": 8,
    "num_stages": 2,
    "BLOCK_M": 64,
    "BLOCK_N": 128,
    "seq_len": 128,
    "num_heads": 32,
    "head_dim": 64,
    "time_ms": 0.0122
  },
  {
    "config": "w8_s2_m128_n128",
    "num_warps": 8,
    "num_stages": 2,
    "BLOCK_M": 128,
    "BLOCK_N": 128,
    "seq_len": 128,
    "num_heads": 32,
    "head_dim": 64,
    "time_ms": 0.0125
  },
  {
    "config": "w8_s3_m64_n64",
    "num_warps": 8,
    "num_stages": 3,
    "BLOCK_M": 64,
    "BLOCK_N": 64,
    "seq_len": 128,
    "num_heads": 32,
    "head_dim": 64,
    "time_ms": 0.0126
  },
  {
    "config": "w8_s3_m64_n128",
    "num_warps": 8,
    "num_stages": 3,
    "BLOCK_M": 64,
    "BLOCK_N": 128,
    "seq_len": 128,
    "num_heads": 32,
    "head_dim": 64,
    "time_ms": 0.0122
  },
  {
    "config": "w8_s3_m128_n128",
    "num_warps": 8,
    "num_stages": 3,
    "BLOCK_M": 128,
    "BLOCK_N": 128,
    "seq_len": 128,
    "num_heads": 32,
    "head_dim": 64,
    "time_ms": 0.0125
  },
  {
    "config": "w16_s1_m64_n64",
    "num_warps": 16,
    "num_stages": 1,
    "BLOCK_M": 64,
    "BLOCK_N": 64,
    "seq_len": 128,
    "num_heads": 32,
    "head_dim": 64,
    "time_ms": 0.0152
  },
  {
    "config": "w16_s1_m64_n128",
    "num_warps": 16,
    "num_stages": 1,
    "BLOCK_M": 64,
    "BLOCK_N": 128,
    "seq_len": 128,
    "num_heads": 32,
    "head_dim": 64,
    "time_ms": 0.0152
  },
  {
    "config": "w16_s1_m128_n128",
    "num_warps": 16,
    "num_stages": 1,
    "BLOCK_M": 128,
    "BLOCK_N": 128,
    "seq_len": 128,
    "num_heads": 32,
    "head_dim": 64,
    "time_ms": 0.0145
  },
  {
    "config": "w16_s2_m64_n64",
    "num_warps": 16,
    "num_stages": 2,
    "BLOCK_M": 64,
    "BLOCK_N": 64,
    "seq_len": 128,
    "num_heads": 32,
    "head_dim": 64,
    "time_ms": 0.0161
  },
  {
    "config": "w16_s2_m64_n128",
    "num_warps": 16,
    "num_stages": 2,
    "BLOCK_M": 64,
    "BLOCK_N": 128,
    "seq_len": 128,
    "num_heads": 32,
    "head_dim": 64,
    "time_ms": 0.0142
  },
  {
    "config": "w16_s2_m128_n128",
    "num_warps": 16,
    "num_stages": 2,
    "BLOCK_M": 128,
    "BLOCK_N": 128,
    "seq_len": 128,
    "num_heads": 32,
    "head_dim": 64,
    "time_ms": 0.0148
  },
  {
    "config": "w16_s3_m64_n64",
    "num_warps": 16,
    "num_stages": 3,
    "BLOCK_M": 64,
    "BLOCK_N": 64,
    "seq_len": 128,
    "num_heads": 32,
    "head_dim": 64,
    "time_ms": 0.0153
  },
  {
    "config": "w16_s3_m64_n128",
    "num_warps": 16,
    "num_stages": 3,
    "BLOCK_M": 64,
    "BLOCK_N": 128,
    "seq_len": 128,
    "num_heads": 32,
    "head_dim": 64,
    "time_ms": 0.0141
  },
  {
    "config": "w16_s3_m128_n128",
    "num_warps": 16,
    "num_stages": 3,
    "BLOCK_M": 128,
    "BLOCK_N": 128,
    "seq_len": 128,
    "num_heads": 32,
    "head_dim": 64,
    "time_ms": 0.0148
  },
  {
    "config": "w4_s1_m64_n64",
    "num_warps": 4,
    "num_stages": 1,
    "BLOCK_M": 64,
    "BLOCK_N": 64,
    "seq_len": 128,
    "num_heads": 32,
    "head_dim": 128,
    "time_ms": 0.0145
  },
  {
    "config": "w4_s1_m64_n128",
    "num_warps": 4,
    "num_stages": 1,
    "BLOCK_M": 64,
    "BLOCK_N": 128,
    "seq_len": 128,
    "num_heads": 32,
    "head_dim": 128,
    "time_ms": 0.0138
  },
  {
    "config": "w4_s1_m128_n128",
    "num_warps": 4,
    "num_stages": 1,
    "BLOCK_M": 128,
    "BLOCK_N": 128,
    "seq_len": 128,
    "num_heads": 32,
    "head_dim": 128,
    "time_ms": 0.0249
  },
  {
    "config": "w4_s2_m64_n64",
    "num_warps": 4,
    "num_stages": 2,
    "BLOCK_M": 64,
    "BLOCK_N": 64,
    "seq_len": 128,
    "num_heads": 32,
    "head_dim": 128,
    "time_ms": 0.014
  },
  {
    "config": "w4_s2_m64_n128",
    "num_warps": 4,
    "num_stages": 2,
    "BLOCK_M": 64,
    "BLOCK_N": 128,
    "seq_len": 128,
    "num_heads": 32,
    "head_dim": 128,
    "time_ms": 0.0134
  },
  {
    "config": "w4_s2_m128_n128",
    "num_warps": 4,
    "num_stages": 2,
    "BLOCK_M": 128,
    "BLOCK_N": 128,
    "seq_len": 128,
    "num_heads": 32,
    "head_dim": 128,
    "time_ms": 0.0213
  },
  {
    "config": "w4_s3_m64_n64",
    "num_warps": 4,
    "num_stages": 3,
    "BLOCK_M": 64,
    "BLOCK_N": 64,
    "seq_len": 128,
    "num_heads": 32,
    "head_dim": 128,
    "time_ms": 0.0134
  },
  {
    "config": "w4_s3_m64_n128",
    "num_warps": 4,
    "num_stages": 3,
    "BLOCK_M": 64,
    "BLOCK_N": 128,
    "seq_len": 128,
    "num_heads": 32,
    "head_dim": 128,
    "time_ms": 0.0142
  },
  {
    "config": "w4_s3_m128_n128",
    "num_warps": 4,
    "num_stages": 3,
    "BLOCK_M": 128,
    "BLOCK_N": 128,
    "seq_len": 128,
    "num_heads": 32,
    "head_dim": 128,
    "time_ms": 0.0217
  },
  {
    "config": "w8_s1_m64_n64",
    "num_warps": 8,
    "num_stages": 1,
    "BLOCK_M": 64,
    "BLOCK_N": 64,
    "seq_len": 128,
    "num_heads": 32,
    "head_dim": 128,
    "time_ms": 0.014
  },
  {
    "config": "w8_s1_m64_n128",
    "num_warps": 8,
    "num_stages": 1,
    "BLOCK_M": 64,
    "BLOCK_N": 128,
    "seq_len": 128,
    "num_heads": 32,
    "head_dim": 128,
    "time_ms": 0.0127
  },
  {
    "config": "w8_s1_m128_n128",
    "num_warps": 8,
    "num_stages": 1,
    "BLOCK_M": 128,
    "BLOCK_N": 128,
    "seq_len": 128,
    "num_heads": 32,
    "head_dim": 128,
    "time_ms": 0.0152
  },
  {
    "config": "w8_s2_m64_n64",
    "num_warps": 8,
    "num_stages": 2,
    "BLOCK_M": 64,
    "BLOCK_N": 64,
    "seq_len": 128,
    "num_heads": 32,
    "head_dim": 128,
    "time_ms": 0.014
  },
  {
    "config": "w8_s2_m64_n128",
    "num_warps": 8,
    "num_stages": 2,
    "BLOCK_M": 64,
    "BLOCK_N": 128,
    "seq_len": 128,
    "num_heads": 32,
    "head_dim": 128,
    "time_ms": 0.0127
  },
  {
    "config": "w8_s2_m128_n128",
    "num_warps": 8,
    "num_stages": 2,
    "BLOCK_M": 128,
    "BLOCK_N": 128,
    "seq_len": 128,
    "num_heads": 32,
    "head_dim": 128,
    "time_ms": 0.0152
  },
  {
    "config": "w8_s3_m64_n64",
    "num_warps": 8,
    "num_stages": 3,
    "BLOCK_M": 64,
    "BLOCK_N": 64,
    "seq_len": 128,
    "num_heads": 32,
    "head_dim": 128,
    "time_ms": 0.0133
  },
  {
    "config": "w8_s3_m64_n128",
    "num_warps": 8,
    "num_stages": 3,
    "BLOCK_M": 64,
    "BLOCK_N": 128,
    "seq_len": 128,
    "num_heads": 32,
    "head_dim": 128,
    "time_ms": 0.0128
  },
  {
    "config": "w8_s3_m128_n128",
    "num_warps": 8,
    "num_stages": 3,
    "BLOCK_M": 128,
    "BLOCK_N": 128,
    "seq_len": 128,
    "num_heads": 32,
    "head_dim": 128,
    "time_ms": 0.0153
  },
  {
    "config": "w16_s1_m64_n64",
    "num_warps": 16,
    "num_stages": 1,
    "BLOCK_M": 64,
    "BLOCK_N": 64,
    "seq_len": 128,
    "num_heads": 32,
    "head_dim": 128,
    "time_ms": 0.0169
  },
  {
    "config": "w16_s1_m64_n128",
    "num_warps": 16,
    "num_stages": 1,
    "BLOCK_M": 64,
    "BLOCK_N": 128,
    "seq_len": 128,
    "num_heads": 32,
    "head_dim": 128,
    "time_ms": 0.0159
  },
  {
    "config": "w16_s1_m128_n128",
    "num_warps": 16,
    "num_stages": 1,
    "BLOCK_M": 128,
    "BLOCK_N": 128,
    "seq_len": 128,
    "num_heads": 32,
    "head_dim": 128,
    "time_ms": 0.0187
  },
  {
    "config": "w16_s2_m64_n64",
    "num_warps": 16,
    "num_stages": 2,
    "BLOCK_M": 64,
    "BLOCK_N": 64,
    "seq_len": 128,
    "num_heads": 32,
    "head_dim": 128,
    "time_ms": 0.0175
  },
  {
    "config": "w16_s2_m64_n128",
    "num_warps": 16,
    "num_stages": 2,
    "BLOCK_M": 64,
    "BLOCK_N": 128,
    "seq_len": 128,
    "num_heads": 32,
    "head_dim": 128,
    "time_ms": 0.0156
  },
  {
    "config": "w16_s2_m128_n128",
    "num_warps": 16,
    "num_stages": 2,
    "BLOCK_M": 128,
    "BLOCK_N": 128,
    "seq_len": 128,
    "num_heads": 32,
    "head_dim": 128,
    "time_ms": 0.0163
  },
  {
    "config": "w16_s3_m64_n64",
    "num_warps": 16,
    "num_stages": 3,
    "BLOCK_M": 64,
    "BLOCK_N": 64,
    "seq_len": 128,
    "num_heads": 32,
    "head_dim": 128,
    "time_ms": 0.0167
  },
  {
    "config": "w16_s3_m64_n128",
    "num_warps": 16,
    "num_stages": 3,
    "BLOCK_M": 64,
    "BLOCK_N": 128,
    "seq_len": 128,
    "num_heads": 32,
    "head_dim": 128,
    "time_ms": 0.0159
  },
  {
    "config": "w16_s3_m128_n128",
    "num_warps": 16,
    "num_stages": 3,
    "BLOCK_M": 128,
    "BLOCK_N": 128,
    "seq_len": 128,
    "num_heads": 32,
    "head_dim": 128,
    "time_ms": 0.0164
  },
  {
    "config": "w4_s1_m64_n64",
    "num_warps": 4,
    "num_stages": 1,
    "BLOCK_M": 64,
    "BLOCK_N": 64,
    "seq_len": 512,
    "num_heads": 4,
    "head_dim": 64,
    "time_ms": 0.0231
  },
  {
    "config": "w4_s1_m64_n128",
    "num_warps": 4,
    "num_stages": 1,
    "BLOCK_M": 64,
    "BLOCK_N": 128,
    "seq_len": 512,
    "num_heads": 4,
    "head_dim": 64,
    "time_ms": 0.0201
  },
  {
    "config": "w4_s1_m128_n128",
    "num_warps": 4,
    "num_stages": 1,
    "BLOCK_M": 128,
    "BLOCK_N": 128,
    "seq_len": 512,
    "num_heads": 4,
    "head_dim": 64,
    "time_ms": 0.041
  },
  {
    "config": "w4_s2_m64_n64",
    "num_warps": 4,
    "num_stages": 2,
    "BLOCK_M": 64,
    "BLOCK_N": 64,
    "seq_len": 512,
    "num_heads": 4,
    "head_dim": 64,
    "time_ms": 0.0197
  },
  {
    "config": "w4_s2_m64_n128",
    "num_warps": 4,
    "num_stages": 2,
    "BLOCK_M": 64,
    "BLOCK_N": 128,
    "seq_len": 512,
    "num_heads": 4,
    "head_dim": 64,
    "time_ms": 0.0164
  },
  {
    "config": "w4_s2_m128_n128",
    "num_warps": 4,
    "num_stages": 2,
    "BLOCK_M": 128,
    "BLOCK_N": 128,
    "seq_len": 512,
    "num_heads": 4,
    "head_dim": 64,
    "time_ms": 0.037
  },
  {
    "config": "w4_s3_m64_n64",
    "num_warps": 4,
    "num_stages": 3,
    "BLOCK_M": 64,
    "BLOCK_N": 64,
    "seq_len": 512,
    "num_heads": 4,
    "head_dim": 64,
    "time_ms": 0.0159
  },
  {
    "config": "w4_s3_m64_n128",
    "num_warps": 4,
    "num_stages": 3,
    "BLOCK_M": 64,
    "BLOCK_N": 128,
    "seq_len": 512,
    "num_heads": 4,
    "head_dim": 64,
    "time_ms": 0.0148
  },
  {
    "config": "w4_s3_m128_n128",
    "num_warps": 4,
    "num_stages": 3,
    "BLOCK_M": 128,
    "BLOCK_N": 128,
    "seq_len": 512,
    "num_heads": 4,
    "head_dim": 64,
    "time_ms": 0.0358
  },
  {
    "config": "w8_s1_m64_n64",
    "num_warps": 8,
    "num_stages": 1,
    "BLOCK_M": 64,
    "BLOCK_N": 64,
    "seq_len": 512,
    "num_heads": 4,
    "head_dim": 64,
    "time_ms": 0.0233
  },
  {
    "config": "w8_s1_m64_n128",
    "num_warps": 8,
    "num_stages": 1,
    "BLOCK_M": 64,
    "BLOCK_N": 128,
    "seq_len": 512,
    "num_heads": 4,
    "head_dim": 64,
    "time_ms": 0.02
  },
  {
    "config": "w8_s1_m128_n128",
    "num_warps": 8,
    "num_stages": 1,
    "BLOCK_M": 128,
    "BLOCK_N": 128,
    "seq_len": 512,
    "num_heads": 4,
    "head_dim": 64,
    "time_ms": 0.0214
  },
  {
    "config": "w8_s2_m64_n64",
    "num_warps": 8,
    "num_stages": 2,
    "BLOCK_M": 64,
    "BLOCK_N": 64,
    "seq_len": 512,
    "num_heads": 4,
    "head_dim": 64,
    "time_ms": 0.0237
  },
  {
    "config": "w8_s2_m64_n128",
    "num_warps": 8,
    "num_stages": 2,
    "BLOCK_M": 64,
    "BLOCK_N": 128,
    "seq_len": 512,
    "num_heads": 4,
    "head_dim": 64,
    "time_ms": 0.0199
  },
  {
    "config": "w8_s2_m128_n128",
    "num_warps": 8,
    "num_stages": 2,
    "BLOCK_M": 128,
    "BLOCK_N": 128,
    "seq_len": 512,
    "num_heads": 4,
    "head_dim": 64,
    "time_ms": 0.0202
  },
  {
    "config": "w8_s3_m64_n64",
    "num_warps": 8,
    "num_stages": 3,
    "BLOCK_M": 64,
    "BLOCK_N": 64,
    "seq_len": 512,
    "num_heads": 4,
    "head_dim": 64,
    "time_ms": 0.0203
  },
  {
    "config": "w8_s3_m64_n128",
    "num_warps": 8,
    "num_stages": 3,
    "BLOCK_M": 64,
    "BLOCK_N": 128,
    "seq_len": 512,
    "num_heads": 4,
    "head_dim": 64,
    "time_ms": 0.0181
  },
  {
    "config": "w8_s3_m128_n128",
    "num_warps": 8,
    "num_stages": 3,
    "BLOCK_M": 128,
    "BLOCK_N": 128,
    "seq_len": 512,
    "num_heads": 4,
    "head_dim": 64,
    "time_ms": 0.0183
  },
  {
    "config": "w16_s1_m64_n64",
    "num_warps": 16,
    "num_stages": 1,
    "BLOCK_M": 64,
    "BLOCK_N": 64,
    "seq_len": 512,
    "num_heads": 4,
    "head_dim": 64,
    "time_ms": 0.0318
  },
  {
    "config": "w16_s1_m64_n128",
    "num_warps": 16,
    "num_stages": 1,
    "BLOCK_M": 64,
    "BLOCK_N": 128,
    "seq_len": 512,
    "num_heads": 4,
    "head_dim": 64,
    "time_ms": 0.0319
  },
  {
    "config": "w16_s1_m128_n128",
    "num_warps": 16,
    "num_stages": 1,
    "BLOCK_M": 128,
    "BLOCK_N": 128,
    "seq_len": 512,
    "num_heads": 4,
    "head_dim": 64,
    "time_ms": 0.0285
  },
  {
    "config": "w16_s2_m64_n64",
    "num_warps": 16,
    "num_stages": 2,
    "BLOCK_M": 64,
    "BLOCK_N": 64,
    "seq_len": 512,
    "num_heads": 4,
    "head_dim": 64,
    "time_ms": 0.0347
  },
  {
    "config": "w16_s2_m64_n128",
    "num_warps": 16,
    "num_stages": 2,
    "BLOCK_M": 64,
    "BLOCK_N": 128,
    "seq_len": 512,
    "num_heads": 4,
    "head_dim": 64,
    "time_ms": 0.0275
  },
  {
    "config": "w16_s2_m128_n128",
    "num_warps": 16,
    "num_stages": 2,
    "BLOCK_M": 128,
    "BLOCK_N": 128,
    "seq_len": 512,
    "num_heads": 4,
    "head_dim": 64,
    "time_ms": 0.0288
  },
  {
    "config": "w16_s3_m64_n64",
    "num_warps": 16,
    "num_stages": 3,
    "BLOCK_M": 64,
    "BLOCK_N": 64,
    "seq_len": 512,
    "num_heads": 4,
    "head_dim": 64,
    "time_ms": 0.031
  },
  {
    "config": "w16_s3_m64_n128",
    "num_warps": 16,
    "num_stages": 3,
    "BLOCK_M": 64,
    "BLOCK_N": 128,
    "seq_len": 512,
    "num_heads": 4,
    "head_dim": 64,
    "time_ms": 0.0255
  },
  {
    "config": "w16_s3_m128_n128",
    "num_warps": 16,
    "num_stages": 3,
    "BLOCK_M": 128,
    "BLOCK_N": 128,
    "seq_len": 512,
    "num_heads": 4,
    "head_dim": 64,
    "time_ms": 0.0264
  },
  {
    "config": "w4_s1_m64_n64",
    "num_warps": 4,
    "num_stages": 1,
    "BLOCK_M": 64,
    "BLOCK_N": 64,
    "seq_len": 512,
    "num_heads": 4,
    "head_dim": 128,
    "time_ms": 0.0311
  },
  {
    "config": "w4_s1_m64_n128",
    "num_warps": 4,
    "num_stages": 1,
    "BLOCK_M": 64,
    "BLOCK_N": 128,
    "seq_len": 512,
    "num_heads": 4,
    "head_dim": 128,
    "time_ms": 0.028
  },
  {
    "config": "w4_s1_m128_n128",
    "num_warps": 4,
    "num_stages": 1,
    "BLOCK_M": 128,
    "BLOCK_N": 128,
    "seq_len": 512,
    "num_heads": 4,
    "head_dim": 128,
    "time_ms": 0.0644
  },
  {
    "config": "w4_s2_m64_n64",
    "num_warps": 4,
    "num_stages": 2,
    "BLOCK_M": 64,
    "BLOCK_N": 64,
    "seq_len": 512,
    "num_heads": 4,
    "head_dim": 128,
    "time_ms": 0.0292
  },
  {
    "config": "w4_s2_m64_n128",
    "num_warps": 4,
    "num_stages": 2,
    "BLOCK_M": 64,
    "BLOCK_N": 128,
    "seq_len": 512,
    "num_heads": 4,
    "head_dim": 128,
    "time_ms": 0.0254
  },
  {
    "config": "w4_s2_m128_n128",
    "num_warps": 4,
    "num_stages": 2,
    "BLOCK_M": 128,
    "BLOCK_N": 128,
    "seq_len": 512,
    "num_heads": 4,
    "head_dim": 128,
    "time_ms": 0.0531
  },
  {
    "config": "w4_s3_m64_n64",
    "num_warps": 4,
    "num_stages": 3,
    "BLOCK_M": 64,
    "BLOCK_N": 64,
    "seq_len": 512,
    "num_heads": 4,
    "head_dim": 128,
    "time_ms": 0.0246
  },
  {
    "config": "w4_s3_m64_n128",
    "num_warps": 4,
    "num_stages": 3,
    "BLOCK_M": 64,
    "BLOCK_N": 128,
    "seq_len": 512,
    "num_heads": 4,
    "head_dim": 128,
    "time_ms": 0.0255
  },
  {
    "config": "w4_s3_m128_n128",
    "num_warps": 4,
    "num_stages": 3,
    "BLOCK_M": 128,
    "BLOCK_N": 128,
    "seq_len": 512,
    "num_heads": 4,
    "head_dim": 128,
    "time_ms": 0.0516
  },
  {
    "config": "w8_s1_m64_n64",
    "num_warps": 8,
    "num_stages": 1,
    "BLOCK_M": 64,
    "BLOCK_N": 64,
    "seq_len": 512,
    "num_heads": 4,
    "head_dim": 128,
    "time_ms": 0.0292
  },
  {
    "config": "w8_s1_m64_n128",
    "num_warps": 8,
    "num_stages": 1,
    "BLOCK_M": 64,
    "BLOCK_N": 128,
    "seq_len": 512,
    "num_heads": 4,
    "head_dim": 128,
    "time_ms": 0.0251
  },
  {
    "config": "w8_s1_m128_n128",
    "num_warps": 8,
    "num_stages": 1,
    "BLOCK_M": 128,
    "BLOCK_N": 128,
    "seq_len": 512,
    "num_heads": 4,
    "head_dim": 128,
    "time_ms": 0.0314
  },
  {
    "config": "w8_s2_m64_n64",
    "num_warps": 8,
    "num_stages": 2,
    "BLOCK_M": 64,
    "BLOCK_N": 64,
    "seq_len": 512,
    "num_heads": 4,
    "head_dim": 128,
    "time_ms": 0.0288
  },
  {
    "config": "w8_s2_m64_n128",
    "num_warps": 8,
    "num_stages": 2,
    "BLOCK_M": 64,
    "BLOCK_N": 128,
    "seq_len": 512,
    "num_heads": 4,
    "head_dim": 128,
    "time_ms": 0.0234
  },
  {
    "config": "w8_s2_m128_n128",
    "num_warps": 8,
    "num_stages": 2,
    "BLOCK_M": 128,
    "BLOCK_N": 128,
    "seq_len": 512,
    "num_heads": 4,
    "head_dim": 128,
    "time_ms": 0.0313
  },
  {
    "config": "w8_s3_m64_n64",
    "num_warps": 8,
    "num_stages": 3,
    "BLOCK_M": 64,
    "BLOCK_N": 64,
    "seq_len": 512,
    "num_heads": 4,
    "head_dim": 128,
    "time_ms": 0.0246
  },
  {
    "config": "w8_s3_m64_n128",
    "num_warps": 8,
    "num_stages": 3,
    "BLOCK_M": 64,
    "BLOCK_N": 128,
    "seq_len": 512,
    "num_heads": 4,
    "head_dim": 128,
    "time_ms": 0.0216
  },
  {
    "config": "w8_s3_m128_n128",
    "num_warps": 8,
    "num_stages": 3,
    "BLOCK_M": 128,
    "BLOCK_N": 128,
    "seq_len": 512,
    "num_heads": 4,
    "head_dim": 128,
    "time_ms": 0.0292
  },
  {
    "config": "w16_s1_m64_n64",
    "num_warps": 16,
    "num_stages": 1,
    "BLOCK_M": 64,
    "BLOCK_N": 64,
    "seq_len": 512,
    "num_heads": 4,
    "head_dim": 128,
    "time_ms": 0.0412
  },
  {
    "config": "w16_s1_m64_n128",
    "num_warps": 16,
    "num_stages": 1,
    "BLOCK_M": 64,
    "BLOCK_N": 128,
    "seq_len": 512,
    "num_heads": 4,
    "head_dim": 128,
    "time_ms": 0.0364
  },
  {
    "config": "w16_s1_m128_n128",
    "num_warps": 16,
    "num_stages": 1,
    "BLOCK_M": 128,
    "BLOCK_N": 128,
    "seq_len": 512,
    "num_heads": 4,
    "head_dim": 128,
    "time_ms": 0.0437
  },
  {
    "config": "w16_s2_m64_n64",
    "num_warps": 16,
    "num_stages": 2,
    "BLOCK_M": 64,
    "BLOCK_N": 64,
    "seq_len": 512,
    "num_heads": 4,
    "head_dim": 128,
    "time_ms": 0.0421
  },
  {
    "config": "w16_s2_m64_n128",
    "num_warps": 16,
    "num_stages": 2,
    "BLOCK_M": 64,
    "BLOCK_N": 128,
    "seq_len": 512,
    "num_heads": 4,
    "head_dim": 128,
    "time_ms": 0.0334
  },
  {
    "config": "w16_s2_m128_n128",
    "num_warps": 16,
    "num_stages": 2,
    "BLOCK_M": 128,
    "BLOCK_N": 128,
    "seq_len": 512,
    "num_heads": 4,
    "head_dim": 128,
    "time_ms": 0.0354
  },
  {
    "config": "w16_s3_m64_n64",
    "num_warps": 16,
    "num_stages": 3,
    "BLOCK_M": 64,
    "BLOCK_N": 64,
    "seq_len": 512,
    "num_heads": 4,
    "head_dim": 128,
    "time_ms": 0.0385
  },
  {
    "config": "w16_s3_m64_n128",
    "num_warps": 16,
    "num_stages": 3,
    "BLOCK_M": 64,
    "BLOCK_N": 128,
    "seq_len": 512,
    "num_heads": 4,
    "head_dim": 128,
    "time_ms": 0.0316
  },
  {
    "config": "w16_s3_m128_n128",
    "num_warps": 16,
    "num_stages": 3,
    "BLOCK_M": 128,
    "BLOCK_N": 128,
    "seq_len": 512,
    "num_heads": 4,
    "head_dim": 128,
    "time_ms": 0.0341
  },
  {
    "config": "w4_s1_m64_n64",
    "num_warps": 4,
    "num_stages": 1,
    "BLOCK_M": 64,
    "BLOCK_N": 64,
    "seq_len": 512,
    "num_heads": 32,
    "head_dim": 64,
    "time_ms": 0.0252
  },
  {
    "config": "w4_s1_m64_n128",
    "num_warps": 4,
    "num_stages": 1,
    "BLOCK_M": 64,
    "BLOCK_N": 128,
    "seq_len": 512,
    "num_heads": 32,
    "head_dim": 64,
    "time_ms": 0.0222
  },
  {
    "config": "w4_s1_m128_n128",
    "num_warps": 4,
    "num_stages": 1,
    "BLOCK_M": 128,
    "BLOCK_N": 128,
    "seq_len": 512,
    "num_heads": 32,
    "head_dim": 64,
    "time_ms": 0.0456
  },
  {
    "config": "w4_s2_m64_n64",
    "num_warps": 4,
    "num_stages": 2,
    "BLOCK_M": 64,
    "BLOCK_N": 64,
    "seq_len": 512,
    "num_heads": 32,
    "head_dim": 64,
    "time_ms": 0.0221
  },
  {
    "config": "w4_s2_m64_n128",
    "num_warps": 4,
    "num_stages": 2,
    "BLOCK_M": 64,
    "BLOCK_N": 128,
    "seq_len": 512,
    "num_heads": 32,
    "head_dim": 64,
    "time_ms": 0.0194
  },
  {
    "config": "w4_s2_m128_n128",
    "num_warps": 4,
    "num_stages": 2,
    "BLOCK_M": 128,
    "BLOCK_N": 128,
    "seq_len": 512,
    "num_heads": 32,
    "head_dim": 64,
    "time_ms": 0.0402
  },
  {
    "config": "w4_s3_m64_n64",
    "num_warps": 4,
    "num_stages": 3,
    "BLOCK_M": 64,
    "BLOCK_N": 64,
    "seq_len": 512,
    "num_heads": 32,
    "head_dim": 64,
    "time_ms": 0.0194
  },
  {
    "config": "w4_s3_m64_n128",
    "num_warps": 4,
    "num_stages": 3,
    "BLOCK_M": 64,
    "BLOCK_N": 128,
    "seq_len": 512,
    "num_heads": 32,
    "head_dim": 64,
    "time_ms": 0.0191
  },
  {
    "config": "w4_s3_m128_n128",
    "num_warps": 4,
    "num_stages": 3,
    "BLOCK_M": 128,
    "BLOCK_N": 128,
    "seq_len": 512,
    "num_heads": 32,
    "head_dim": 64,
    "time_ms": 0.0388
  },
  {
    "config": "w8_s1_m64_n64",
    "num_warps": 8,
    "num_stages": 1,
    "BLOCK_M": 64,
    "BLOCK_N": 64,
    "seq_len": 512,
    "num_heads": 32,
    "head_dim": 64,
    "time_ms": 0.0271
  },
  {
    "config": "w8_s1_m64_n128",
    "num_warps": 8,
    "num_stages": 1,
    "BLOCK_M": 64,
    "BLOCK_N": 128,
    "seq_len": 512,
    "num_heads": 32,
    "head_dim": 64,
    "time_ms": 0.0282
  },
  {
    "config": "w8_s1_m128_n128",
    "num_warps": 8,
    "num_stages": 1,
    "BLOCK_M": 128,
    "BLOCK_N": 128,
    "seq_len": 512,
    "num_heads": 32,
    "head_dim": 64,
    "time_ms": 0.0236
  },
  {
    "config": "w8_s2_m64_n64",
    "num_warps": 8,
    "num_stages": 2,
    "BLOCK_M": 64,
    "BLOCK_N": 64,
    "seq_len": 512,
    "num_heads": 32,
    "head_dim": 64,
    "time_ms": 0.0271
  },
  {
    "config": "w8_s2_m64_n128",
    "num_warps": 8,
    "num_stages": 2,
    "BLOCK_M": 64,
    "BLOCK_N": 128,
    "seq_len": 512,
    "num_heads": 32,
    "head_dim": 64,
    "time_ms": 0.0286
  },
  {
    "config": "w8_s2_m128_n128",
    "num_warps": 8,
    "num_stages": 2,
    "BLOCK_M": 128,
    "BLOCK_N": 128,
    "seq_len": 512,
    "num_heads": 32,
    "head_dim": 64,
    "time_ms": 0.0227
  },
  {
    "config": "w8_s3_m64_n64",
    "num_warps": 8,
    "num_stages": 3,
    "BLOCK_M": 64,
    "BLOCK_N": 64,
    "seq_len": 512,
    "num_heads": 32,
    "head_dim": 64,
    "time_ms": 0.0259
  },
  {
    "config": "w8_s3_m64_n128",
    "num_warps": 8,
    "num_stages": 3,
    "BLOCK_M": 64,
    "BLOCK_N": 128,
    "seq_len": 512,
    "num_heads": 32,
    "head_dim": 64,
    "time_ms": 0.0268
  },
  {
    "config": "w8_s3_m128_n128",
    "num_warps": 8,
    "num_stages": 3,
    "BLOCK_M": 128,
    "BLOCK_N": 128,
    "seq_len": 512,
    "num_heads": 32,
    "head_dim": 64,
    "time_ms": 0.0203
  },
  {
    "config": "w16_s1_m64_n64",
    "num_warps": 16,
    "num_stages": 1,
    "BLOCK_M": 64,
    "BLOCK_N": 64,
    "seq_len": 512,
    "num_heads": 32,
    "head_dim": 64,
    "time_ms": 0.0453
  },
  {
    "config": "w16_s1_m64_n128",
    "num_warps": 16,
    "num_stages": 1,
    "BLOCK_M": 64,
    "BLOCK_N": 128,
    "seq_len": 512,
    "num_heads": 32,
    "head_dim": 64,
    "time_ms": 0.0469
  },
  {
    "config": "w16_s1_m128_n128",
    "num_warps": 16,
    "num_stages": 1,
    "BLOCK_M": 128,
    "BLOCK_N": 128,
    "seq_len": 512,
    "num_heads": 32,
    "head_dim": 64,
    "time_ms": 0.0306
  },
  {
    "config": "w16_s2_m64_n64",
    "num_warps": 16,
    "num_stages": 2,
    "BLOCK_M": 64,
    "BLOCK_N": 64,
    "seq_len": 512,
    "num_heads": 32,
    "head_dim": 64,
    "time_ms": 0.0491
  },
  {
    "config": "w16_s2_m64_n128",
    "num_warps": 16,
    "num_stages": 2,
    "BLOCK_M": 64,
    "BLOCK_N": 128,
    "seq_len": 512,
    "num_heads": 32,
    "head_dim": 64,
    "time_ms": 0.0399
  },
  {
    "config": "w16_s2_m128_n128",
    "num_warps": 16,
    "num_stages": 2,
    "BLOCK_M": 128,
    "BLOCK_N": 128,
    "seq_len": 512,
    "num_heads": 32,
    "head_dim": 64,
    "time_ms": 0.0314
  },
  {
    "config": "w16_s3_m64_n64",
    "num_warps": 16,
    "num_stages": 3,
    "BLOCK_M": 64,
    "BLOCK_N": 64,
    "seq_len": 512,
    "num_heads": 32,
    "head_dim": 64,
    "time_ms": 0.0457
  },
  {
    "config": "w16_s3_m64_n128",
    "num_warps": 16,
    "num_stages": 3,
    "BLOCK_M": 64,
    "BLOCK_N": 128,
    "seq_len": 512,
    "num_heads": 32,
    "head_dim": 64,
    "time_ms": 0.0378
  },
  {
    "config": "w16_s3_m128_n128",
    "num_warps": 16,
    "num_stages": 3,
    "BLOCK_M": 128,
    "BLOCK_N": 128,
    "seq_len": 512,
    "num_heads": 32,
    "head_dim": 64,
    "time_ms": 0.0287
  },
  {
    "config": "w4_s1_m64_n64",
    "num_warps": 4,
    "num_stages": 1,
    "BLOCK_M": 64,
    "BLOCK_N": 64,
    "seq_len": 512,
    "num_heads": 32,
    "head_dim": 128,
    "time_ms": 0.0329
  },
  {
    "config": "w4_s1_m64_n128",
    "num_warps": 4,
    "num_stages": 1,
    "BLOCK_M": 64,
    "BLOCK_N": 128,
    "seq_len": 512,
    "num_heads": 32,
    "head_dim": 128,
    "time_ms": 0.0331
  },
  {
    "config": "w4_s1_m128_n128",
    "num_warps": 4,
    "num_stages": 1,
    "BLOCK_M": 128,
    "BLOCK_N": 128,
    "seq_len": 512,
    "num_heads": 32,
    "head_dim": 128,
    "time_ms": 0.0718
  },
  {
    "config": "w4_s2_m64_n64",
    "num_warps": 4,
    "num_stages": 2,
    "BLOCK_M": 64,
    "BLOCK_N": 64,
    "seq_len": 512,
    "num_heads": 32,
    "head_dim": 128,
    "time_ms": 0.0314
  },
  {
    "config": "w4_s2_m64_n128",
    "num_warps": 4,
    "num_stages": 2,
    "BLOCK_M": 64,
    "BLOCK_N": 128,
    "seq_len": 512,
    "num_heads": 32,
    "head_dim": 128,
    "time_ms": 0.0382
  },
  {
    "config": "w4_s2_m128_n128",
    "num_warps": 4,
    "num_stages": 2,
    "BLOCK_M": 128,
    "BLOCK_N": 128,
    "seq_len": 512,
    "num_heads": 32,
    "head_dim": 128,
    "time_ms": 0.0584
  },
  {
    "config": "w4_s3_m64_n64",
    "num_warps": 4,
    "num_stages": 3,
    "BLOCK_M": 64,
    "BLOCK_N": 64,
    "seq_len": 512,
    "num_heads": 32,
    "head_dim": 128,
    "time_ms": 0.0285
  },
  {
    "config": "w4_s3_m64_n128",
    "num_warps": 4,
    "num_stages": 3,
    "BLOCK_M": 64,
    "BLOCK_N": 128,
    "seq_len": 512,
    "num_heads": 32,
    "head_dim": 128,
    "time_ms": 0.0395
  },
  {
    "config": "w4_s3_m128_n128",
    "num_warps": 4,
    "num_stages": 3,
    "BLOCK_M": 128,
    "BLOCK_N": 128,
    "seq_len": 512,
    "num_heads": 32,
    "head_dim": 128,
    "time_ms": 0.0579
  },
  {
    "config": "w8_s1_m64_n64",
    "num_warps": 8,
    "num_stages": 1,
    "BLOCK_M": 64,
    "BLOCK_N": 64,
    "seq_len": 512,
    "num_heads": 32,
    "head_dim": 128,
    "time_ms": 0.0349
  },
  {
    "config": "w8_s1_m64_n128",
    "num_warps": 8,
    "num_stages": 1,
    "BLOCK_M": 64,
    "BLOCK_N": 128,
    "seq_len": 512,
    "num_heads": 32,
    "head_dim": 128,
    "time_ms": 0.0364
  },
  {
    "config": "w8_s1_m128_n128",
    "num_warps": 8,
    "num_stages": 1,
    "BLOCK_M": 128,
    "BLOCK_N": 128,
    "seq_len": 512,
    "num_heads": 32,
    "head_dim": 128,
    "time_ms": 0.0343
  },
  {
    "config": "w8_s2_m64_n64",
    "num_warps": 8,
    "num_stages": 2,
    "BLOCK_M": 64,
    "BLOCK_N": 64,
    "seq_len": 512,
    "num_heads": 32,
    "head_dim": 128,
    "time_ms": 0.0339
  },
  {
    "config": "w8_s2_m64_n128",
    "num_warps": 8,
    "num_stages": 2,
    "BLOCK_M": 64,
    "BLOCK_N": 128,
    "seq_len": 512,
    "num_heads": 32,
    "head_dim": 128,
    "time_ms": 0.0352
  },
  {
    "config": "w8_s2_m128_n128",
    "num_warps": 8,
    "num_stages": 2,
    "BLOCK_M": 128,
    "BLOCK_N": 128,
    "seq_len": 512,
    "num_heads": 32,
    "head_dim": 128,
    "time_ms": 0.0353
  },
  {
    "config": "w8_s3_m64_n64",
    "num_warps": 8,
    "num_stages": 3,
    "BLOCK_M": 64,
    "BLOCK_N": 64,
    "seq_len": 512,
    "num_heads": 32,
    "head_dim": 128,
    "time_ms": 0.0325
  },
  {
    "config": "w8_s3_m64_n128",
    "num_warps": 8,
    "num_stages": 3,
    "BLOCK_M": 64,
    "BLOCK_N": 128,
    "seq_len": 512,
    "num_heads": 32,
    "head_dim": 128,
    "time_ms": 0.0327
  },
  {
    "config": "w8_s3_m128_n128",
    "num_warps": 8,
    "num_stages": 3,
    "BLOCK_M": 128,
    "BLOCK_N": 128,
    "seq_len": 512,
    "num_heads": 32,
    "head_dim": 128,
    "time_ms": 0.0328
  },
  {
    "config": "w16_s1_m64_n64",
    "num_warps": 16,
    "num_stages": 1,
    "BLOCK_M": 64,
    "BLOCK_N": 64,
    "seq_len": 512,
    "num_heads": 32,
    "head_dim": 128,
    "time_ms": 0.0593
  },
  {
    "config": "w16_s1_m64_n128",
    "num_warps": 16,
    "num_stages": 1,
    "BLOCK_M": 64,
    "BLOCK_N": 128,
    "seq_len": 512,
    "num_heads": 32,
    "head_dim": 128,
    "time_ms": 0.0541
  },
  {
    "config": "w16_s1_m128_n128",
    "num_warps": 16,
    "num_stages": 1,
    "BLOCK_M": 128,
    "BLOCK_N": 128,
    "seq_len": 512,
    "num_heads": 32,
    "head_dim": 128,
    "time_ms": 0.0484
  },
  {
    "config": "w16_s2_m64_n64",
    "num_warps": 16,
    "num_stages": 2,
    "BLOCK_M": 64,
    "BLOCK_N": 64,
    "seq_len": 512,
    "num_heads": 32,
    "head_dim": 128,
    "time_ms": 0.0592
  },
  {
    "config": "w16_s2_m64_n128",
    "num_warps": 16,
    "num_stages": 2,
    "BLOCK_M": 64,
    "BLOCK_N": 128,
    "seq_len": 512,
    "num_heads": 32,
    "head_dim": 128,
    "time_ms": 0.0503
  },
  {
    "config": "w16_s2_m128_n128",
    "num_warps": 16,
    "num_stages": 2,
    "BLOCK_M": 128,
    "BLOCK_N": 128,
    "seq_len": 512,
    "num_heads": 32,
    "head_dim": 128,
    "time_ms": 0.04
  },
  {
    "config": "w16_s3_m64_n64",
    "num_warps": 16,
    "num_stages": 3,
    "BLOCK_M": 64,
    "BLOCK_N": 64,
    "seq_len": 512,
    "num_heads": 32,
    "head_dim": 128,
    "time_ms": 0.0554
  },
  {
    "config": "w16_s3_m64_n128",
    "num_warps": 16,
    "num_stages": 3,
    "BLOCK_M": 64,
    "BLOCK_N": 128,
    "seq_len": 512,
    "num_heads": 32,
    "head_dim": 128,
    "time_ms": 0.0482
  },
  {
    "config": "w16_s3_m128_n128",
    "num_warps": 16,
    "num_stages": 3,
    "BLOCK_M": 128,
    "BLOCK_N": 128,
    "seq_len": 512,
    "num_heads": 32,
    "head_dim": 128,
    "time_ms": 0.0391
  },
  {
    "config": "w4_s1_m64_n64",
    "num_warps": 4,
    "num_stages": 1,
    "BLOCK_M": 64,
    "BLOCK_N": 64,
    "seq_len": 2048,
    "num_heads": 4,
    "head_dim": 64,
    "time_ms": 0.0692
  },
  {
    "config": "w4_s1_m64_n128",
    "num_warps": 4,
    "num_stages": 1,
    "BLOCK_M": 64,
    "BLOCK_N": 128,
    "seq_len": 2048,
    "num_heads": 4,
    "head_dim": 64,
    "time_ms": 0.0581
  },
  {
    "config": "w4_s1_m128_n128",
    "num_warps": 4,
    "num_stages": 1,
    "BLOCK_M": 128,
    "BLOCK_N": 128,
    "seq_len": 2048,
    "num_heads": 4,
    "head_dim": 64,
    "time_ms": 0.1396
  },
  {
    "config": "w4_s2_m64_n64",
    "num_warps": 4,
    "num_stages": 2,
    "BLOCK_M": 64,
    "BLOCK_N": 64,
    "seq_len": 2048,
    "num_heads": 4,
    "head_dim": 64,
    "time_ms": 0.0563
  },
  {
    "config": "w4_s2_m64_n128",
    "num_warps": 4,
    "num_stages": 2,
    "BLOCK_M": 64,
    "BLOCK_N": 128,
    "seq_len": 2048,
    "num_heads": 4,
    "head_dim": 64,
    "time_ms": 0.043
  },
  {
    "config": "w4_s2_m128_n128",
    "num_warps": 4,
    "num_stages": 2,
    "BLOCK_M": 128,
    "BLOCK_N": 128,
    "seq_len": 2048,
    "num_heads": 4,
    "head_dim": 64,
    "time_ms": 0.123
  },
  {
    "config": "w4_s3_m64_n64",
    "num_warps": 4,
    "num_stages": 3,
    "BLOCK_M": 64,
    "BLOCK_N": 64,
    "seq_len": 2048,
    "num_heads": 4,
    "head_dim": 64,
    "time_ms": 0.0383
  },
  {
    "config": "w4_s3_m64_n128",
    "num_warps": 4,
    "num_stages": 3,
    "BLOCK_M": 64,
    "BLOCK_N": 128,
    "seq_len": 2048,
    "num_heads": 4,
    "head_dim": 64,
    "time_ms": 0.0354
  },
  {
    "config": "w4_s3_m128_n128",
    "num_warps": 4,
    "num_stages": 3,
    "BLOCK_M": 128,
    "BLOCK_N": 128,
    "seq_len": 2048,
    "num_heads": 4,
    "head_dim": 64,
    "time_ms": 0.1177
  },
  {
    "config": "w8_s1_m64_n64",
    "num_warps": 8,
    "num_stages": 1,
    "BLOCK_M": 64,
    "BLOCK_N": 64,
    "seq_len": 2048,
    "num_heads": 4,
    "head_dim": 64,
    "time_ms": 0.0692
  },
  {
    "config": "w8_s1_m64_n128",
    "num_warps": 8,
    "num_stages": 1,
    "BLOCK_M": 64,
    "BLOCK_N": 128,
    "seq_len": 2048,
    "num_heads": 4,
    "head_dim": 64,
    "time_ms": 0.0577
  },
  {
    "config": "w8_s1_m128_n128",
    "num_warps": 8,
    "num_stages": 1,
    "BLOCK_M": 128,
    "BLOCK_N": 128,
    "seq_len": 2048,
    "num_heads": 4,
    "head_dim": 64,
    "time_ms": 0.0622
  },
  {
    "config": "w8_s2_m64_n64",
    "num_warps": 8,
    "num_stages": 2,
    "BLOCK_M": 64,
    "BLOCK_N": 64,
    "seq_len": 2048,
    "num_heads": 4,
    "head_dim": 64,
    "time_ms": 0.0718
  },
  {
    "config": "w8_s2_m64_n128",
    "num_warps": 8,
    "num_stages": 2,
    "BLOCK_M": 64,
    "BLOCK_N": 128,
    "seq_len": 2048,
    "num_heads": 4,
    "head_dim": 64,
    "time_ms": 0.0574
  },
  {
    "config": "w8_s2_m128_n128",
    "num_warps": 8,
    "num_stages": 2,
    "BLOCK_M": 128,
    "BLOCK_N": 128,
    "seq_len": 2048,
    "num_heads": 4,
    "head_dim": 64,
    "time_ms": 0.0567
  },
  {
    "config": "w8_s3_m64_n64",
    "num_warps": 8,
    "num_stages": 3,
    "BLOCK_M": 64,
    "BLOCK_N": 64,
    "seq_len": 2048,
    "num_heads": 4,
    "head_dim": 64,
    "time_ms": 0.0574
  },
  {
    "config": "w8_s3_m64_n128",
    "num_warps": 8,
    "num_stages": 3,
    "BLOCK_M": 64,
    "BLOCK_N": 128,
    "seq_len": 2048,
    "num_heads": 4,
    "head_dim": 64,
    "time_ms": 0.0486
  },
  {
    "config": "w8_s3_m128_n128",
    "num_warps": 8,
    "num_stages": 3,
    "BLOCK_M": 128,
    "BLOCK_N": 128,
    "seq_len": 2048,
    "num_heads": 4,
    "head_dim": 64,
    "time_ms": 0.0478
  },
  {
    "config": "w16_s1_m64_n64",
    "num_warps": 16,
    "num_stages": 1,
    "BLOCK_M": 64,
    "BLOCK_N": 64,
    "seq_len": 2048,
    "num_heads": 4,
    "head_dim": 64,
    "time_ms": 0.1036
  },
  {
    "config": "w16_s1_m64_n128",
    "num_warps": 16,
    "num_stages": 1,
    "BLOCK_M": 64,
    "BLOCK_N": 128,
    "seq_len": 2048,
    "num_heads": 4,
    "head_dim": 64,
    "time_ms": 0.1057
  },
  {
    "config": "w16_s1_m128_n128",
    "num_warps": 16,
    "num_stages": 1,
    "BLOCK_M": 128,
    "BLOCK_N": 128,
    "seq_len": 2048,
    "num_heads": 4,
    "head_dim": 64,
    "time_ms": 0.0897
  },
  {
    "config": "w16_s2_m64_n64",
    "num_warps": 16,
    "num_stages": 2,
    "BLOCK_M": 64,
    "BLOCK_N": 64,
    "seq_len": 2048,
    "num_heads": 4,
    "head_dim": 64,
    "time_ms": 0.1145
  },
  {
    "config": "w16_s2_m64_n128",
    "num_warps": 16,
    "num_stages": 2,
    "BLOCK_M": 64,
    "BLOCK_N": 128,
    "seq_len": 2048,
    "num_heads": 4,
    "head_dim": 64,
    "time_ms": 0.087
  },
  {
    "config": "w16_s2_m128_n128",
    "num_warps": 16,
    "num_stages": 2,
    "BLOCK_M": 128,
    "BLOCK_N": 128,
    "seq_len": 2048,
    "num_heads": 4,
    "head_dim": 64,
    "time_ms": 0.0896
  },
  {
    "config": "w16_s3_m64_n64",
    "num_warps": 16,
    "num_stages": 3,
    "BLOCK_M": 64,
    "BLOCK_N": 64,
    "seq_len": 2048,
    "num_heads": 4,
    "head_dim": 64,
    "time_ms": 0.0999
  },
  {
    "config": "w16_s3_m64_n128",
    "num_warps": 16,
    "num_stages": 3,
    "BLOCK_M": 64,
    "BLOCK_N": 128,
    "seq_len": 2048,
    "num_heads": 4,
    "head_dim": 64,
    "time_ms": 0.0782
  },
  {
    "config": "w16_s3_m128_n128",
    "num_warps": 16,
    "num_stages": 3,
    "BLOCK_M": 128,
    "BLOCK_N": 128,
    "seq_len": 2048,
    "num_heads": 4,
    "head_dim": 64,
    "time_ms": 0.0802
  },
  {
    "config": "w4_s1_m64_n64",
    "num_warps": 4,
    "num_stages": 1,
    "BLOCK_M": 64,
    "BLOCK_N": 64,
    "seq_len": 2048,
    "num_heads": 4,
    "head_dim": 128,
    "time_ms": 0.096
  },
  {
    "config": "w4_s1_m64_n128",
    "num_warps": 4,
    "num_stages": 1,
    "BLOCK_M": 64,
    "BLOCK_N": 128,
    "seq_len": 2048,
    "num_heads": 4,
    "head_dim": 128,
    "time_ms": 0.0851
  },
  {
    "config": "w4_s1_m128_n128",
    "num_warps": 4,
    "num_stages": 1,
    "BLOCK_M": 128,
    "BLOCK_N": 128,
    "seq_len": 2048,
    "num_heads": 4,
    "head_dim": 128,
    "time_ms": 0.2209
  },
  {
    "config": "w4_s2_m64_n64",
    "num_warps": 4,
    "num_stages": 2,
    "BLOCK_M": 64,
    "BLOCK_N": 64,
    "seq_len": 2048,
    "num_heads": 4,
    "head_dim": 128,
    "time_ms": 0.0862
  },
  {
    "config": "w4_s2_m64_n128",
    "num_warps": 4,
    "num_stages": 2,
    "BLOCK_M": 64,
    "BLOCK_N": 128,
    "seq_len": 2048,
    "num_heads": 4,
    "head_dim": 128,
    "time_ms": 0.0737
  },
  {
    "config": "w4_s2_m128_n128",
    "num_warps": 4,
    "num_stages": 2,
    "BLOCK_M": 128,
    "BLOCK_N": 128,
    "seq_len": 2048,
    "num_heads": 4,
    "head_dim": 128,
    "time_ms": 0.1783
  },
  {
    "config": "w4_s3_m64_n64",
    "num_warps": 4,
    "num_stages": 3,
    "BLOCK_M": 64,
    "BLOCK_N": 64,
    "seq_len": 2048,
    "num_heads": 4,
    "head_dim": 128,
    "time_ms": 0.0706
  },
  {
    "config": "w4_s3_m64_n128",
    "num_warps": 4,
    "num_stages": 3,
    "BLOCK_M": 64,
    "BLOCK_N": 128,
    "seq_len": 2048,
    "num_heads": 4,
    "head_dim": 128,
    "time_ms": 0.0725
  },
  {
    "config": "w4_s3_m128_n128",
    "num_warps": 4,
    "num_stages": 3,
    "BLOCK_M": 128,
    "BLOCK_N": 128,
    "seq_len": 2048,
    "num_heads": 4,
    "head_dim": 128,
    "time_ms": 0.1726
  },
  {
    "config": "w8_s1_m64_n64",
    "num_warps": 8,
    "num_stages": 1,
    "BLOCK_M": 64,
    "BLOCK_N": 64,
    "seq_len": 2048,
    "num_heads": 4,
    "head_dim": 128,
    "time_ms": 0.0883
  },
  {
    "config": "w8_s1_m64_n128",
    "num_warps": 8,
    "num_stages": 1,
    "BLOCK_M": 64,
    "BLOCK_N": 128,
    "seq_len": 2048,
    "num_heads": 4,
    "head_dim": 128,
    "time_ms": 0.0743
  },
  {
    "config": "w8_s1_m128_n128",
    "num_warps": 8,
    "num_stages": 1,
    "BLOCK_M": 128,
    "BLOCK_N": 128,
    "seq_len": 2048,
    "num_heads": 4,
    "head_dim": 128,
    "time_ms": 0.0971
  },
  {
    "config": "w8_s2_m64_n64",
    "num_warps": 8,
    "num_stages": 2,
    "BLOCK_M": 64,
    "BLOCK_N": 64,
    "seq_len": 2048,
    "num_heads": 4,
    "head_dim": 128,
    "time_ms": 0.0849
  },
  {
    "config": "w8_s2_m64_n128",
    "num_warps": 8,
    "num_stages": 2,
    "BLOCK_M": 64,
    "BLOCK_N": 128,
    "seq_len": 2048,
    "num_heads": 4,
    "head_dim": 128,
    "time_ms": 0.0658
  },
  {
    "config": "w8_s2_m128_n128",
    "num_warps": 8,
    "num_stages": 2,
    "BLOCK_M": 128,
    "BLOCK_N": 128,
    "seq_len": 2048,
    "num_heads": 4,
    "head_dim": 128,
    "time_ms": 0.0946
  },
  {
    "config": "w8_s3_m64_n64",
    "num_warps": 8,
    "num_stages": 3,
    "BLOCK_M": 64,
    "BLOCK_N": 64,
    "seq_len": 2048,
    "num_heads": 4,
    "head_dim": 128,
    "time_ms": 0.0649
  },
  {
    "config": "w8_s3_m64_n128",
    "num_warps": 8,
    "num_stages": 3,
    "BLOCK_M": 64,
    "BLOCK_N": 128,
    "seq_len": 2048,
    "num_heads": 4,
    "head_dim": 128,
    "time_ms": 0.0581
  },
  {
    "config": "w8_s3_m128_n128",
    "num_warps": 8,
    "num_stages": 3,
    "BLOCK_M": 128,
    "BLOCK_N": 128,
    "seq_len": 2048,
    "num_heads": 4,
    "head_dim": 128,
    "time_ms": 0.0859
  },
  {
    "config": "w16_s1_m64_n64",
    "num_warps": 16,
    "num_stages": 1,
    "BLOCK_M": 64,
    "BLOCK_N": 64,
    "seq_len": 2048,
    "num_heads": 4,
    "head_dim": 128,
    "time_ms": 0.1336
  },
  {
    "config": "w16_s1_m64_n128",
    "num_warps": 16,
    "num_stages": 1,
    "BLOCK_M": 64,
    "BLOCK_N": 128,
    "seq_len": 2048,
    "num_heads": 4,
    "head_dim": 128,
    "time_ms": 0.1166
  },
  {
    "config": "w16_s1_m128_n128",
    "num_warps": 16,
    "num_stages": 1,
    "BLOCK_M": 128,
    "BLOCK_N": 128,
    "seq_len": 2048,
    "num_heads": 4,
    "head_dim": 128,
    "time_ms": 0.1442
  },
  {
    "config": "w16_s2_m64_n64",
    "num_warps": 16,
    "num_stages": 2,
    "BLOCK_M": 64,
    "BLOCK_N": 64,
    "seq_len": 2048,
    "num_heads": 4,
    "head_dim": 128,
    "time_ms": 0.1366
  },
  {
    "config": "w16_s2_m64_n128",
    "num_warps": 16,
    "num_stages": 2,
    "BLOCK_M": 64,
    "BLOCK_N": 128,
    "seq_len": 2048,
    "num_heads": 4,
    "head_dim": 128,
    "time_ms": 0.103
  },
  {
    "config": "w16_s2_m128_n128",
    "num_warps": 16,
    "num_stages": 2,
    "BLOCK_M": 128,
    "BLOCK_N": 128,
    "seq_len": 2048,
    "num_heads": 4,
    "head_dim": 128,
    "time_ms": 0.1124
  },
  {
    "config": "w16_s3_m64_n64",
    "num_warps": 16,
    "num_stages": 3,
    "BLOCK_M": 64,
    "BLOCK_N": 64,
    "seq_len": 2048,
    "num_heads": 4,
    "head_dim": 128,
    "time_ms": 0.1208
  },
  {
    "config": "w16_s3_m64_n128",
    "num_warps": 16,
    "num_stages": 3,
    "BLOCK_M": 64,
    "BLOCK_N": 128,
    "seq_len": 2048,
    "num_heads": 4,
    "head_dim": 128,
    "time_ms": 0.0951
  },
  {
    "config": "w16_s3_m128_n128",
    "num_warps": 16,
    "num_stages": 3,
    "BLOCK_M": 128,
    "BLOCK_N": 128,
    "seq_len": 2048,
    "num_heads": 4,
    "head_dim": 128,
    "time_ms": 0.1069
  },
  {
    "config": "w4_s1_m64_n64",
    "num_warps": 4,
    "num_stages": 1,
    "BLOCK_M": 64,
    "BLOCK_N": 64,
    "seq_len": 2048,
    "num_heads": 32,
    "head_dim": 64,
    "time_ms": 0.1181
  },
  {
    "config": "w4_s1_m64_n128",
    "num_warps": 4,
    "num_stages": 1,
    "BLOCK_M": 64,
    "BLOCK_N": 128,
    "seq_len": 2048,
    "num_heads": 32,
    "head_dim": 64,
    "time_ms": 0.1318
  },
  {
    "config": "w4_s1_m128_n128",
    "num_warps": 4,
    "num_stages": 1,
    "BLOCK_M": 128,
    "BLOCK_N": 128,
    "seq_len": 2048,
    "num_heads": 32,
    "head_dim": 64,
    "time_ms": 0.2265
  },
  {
    "config": "w4_s2_m64_n64",
    "num_warps": 4,
    "num_stages": 2,
    "BLOCK_M": 64,
    "BLOCK_N": 64,
    "seq_len": 2048,
    "num_heads": 32,
    "head_dim": 64,
    "time_ms": 0.1116
  },
  {
    "config": "w4_s2_m64_n128",
    "num_warps": 4,
    "num_stages": 2,
    "BLOCK_M": 64,
    "BLOCK_N": 128,
    "seq_len": 2048,
    "num_heads": 32,
    "head_dim": 64,
    "time_ms": 0.1108
  },
  {
    "config": "w4_s2_m128_n128",
    "num_warps": 4,
    "num_stages": 2,
    "BLOCK_M": 128,
    "BLOCK_N": 128,
    "seq_len": 2048,
    "num_heads": 32,
    "head_dim": 64,
    "time_ms": 0.1976
  },
  {
    "config": "w4_s3_m64_n64",
    "num_warps": 4,
    "num_stages": 3,
    "BLOCK_M": 64,
    "BLOCK_N": 64,
    "seq_len": 2048,
    "num_heads": 32,
    "head_dim": 64,
    "time_ms": 0.1067
  },
  {
    "config": "w4_s3_m64_n128",
    "num_warps": 4,
    "num_stages": 3,
    "BLOCK_M": 64,
    "BLOCK_N": 128,
    "seq_len": 2048,
    "num_heads": 32,
    "head_dim": 64,
    "time_ms": 0.1044
  },
  {
    "config": "w4_s3_m128_n128",
    "num_warps": 4,
    "num_stages": 3,
    "BLOCK_M": 128,
    "BLOCK_N": 128,
    "seq_len": 2048,
    "num_heads": 32,
    "head_dim": 64,
    "time_ms": 0.1918
  },
  {
    "config": "w8_s1_m64_n64",
    "num_warps": 8,
    "num_stages": 1,
    "BLOCK_M": 64,
    "BLOCK_N": 64,
    "seq_len": 2048,
    "num_heads": 32,
    "head_dim": 64,
    "time_ms": 0.1954
  },
  {
    "config": "w8_s1_m64_n128",
    "num_warps": 8,
    "num_stages": 1,
    "BLOCK_M": 64,
    "BLOCK_N": 128,
    "seq_len": 2048,
    "num_heads": 32,
    "head_dim": 64,
    "time_ms": 0.2227
  },
  {
    "config": "w8_s1_m128_n128",
    "num_warps": 8,
    "num_stages": 1,
    "BLOCK_M": 128,
    "BLOCK_N": 128,
    "seq_len": 2048,
    "num_heads": 32,
    "head_dim": 64,
    "time_ms": 0.1426
  },
  {
    "config": "w8_s2_m64_n64",
    "num_warps": 8,
    "num_stages": 2,
    "BLOCK_M": 64,
    "BLOCK_N": 64,
    "seq_len": 2048,
    "num_heads": 32,
    "head_dim": 64,
    "time_ms": 0.193
  },
  {
    "config": "w8_s2_m64_n128",
    "num_warps": 8,
    "num_stages": 2,
    "BLOCK_M": 64,
    "BLOCK_N": 128,
    "seq_len": 2048,
    "num_heads": 32,
    "head_dim": 64,
    "time_ms": 0.2134
  },
  {
    "config": "w8_s2_m128_n128",
    "num_warps": 8,
    "num_stages": 2,
    "BLOCK_M": 128,
    "BLOCK_N": 128,
    "seq_len": 2048,
    "num_heads": 32,
    "head_dim": 64,
    "time_ms": 0.125
  },
  {
    "config": "w8_s3_m64_n64",
    "num_warps": 8,
    "num_stages": 3,
    "BLOCK_M": 64,
    "BLOCK_N": 64,
    "seq_len": 2048,
    "num_heads": 32,
    "head_dim": 64,
    "time_ms": 0.1843
  },
  {
    "config": "w8_s3_m64_n128",
    "num_warps": 8,
    "num_stages": 3,
    "BLOCK_M": 64,
    "BLOCK_N": 128,
    "seq_len": 2048,
    "num_heads": 32,
    "head_dim": 64,
    "time_ms": 0.1999
  },
  {
    "config": "w8_s3_m128_n128",
    "num_warps": 8,
    "num_stages": 3,
    "BLOCK_M": 128,
    "BLOCK_N": 128,
    "seq_len": 2048,
    "num_heads": 32,
    "head_dim": 64,
    "time_ms": 0.1169
  },
  {
    "config": "w16_s1_m64_n64",
    "num_warps": 16,
    "num_stages": 1,
    "BLOCK_M": 64,
    "BLOCK_N": 64,
    "seq_len": 2048,
    "num_heads": 32,
    "head_dim": 64,
    "time_ms": 0.4071
  },
  {
    "config": "w16_s1_m64_n128",
    "num_warps": 16,
    "num_stages": 1,
    "BLOCK_M": 64,
    "BLOCK_N": 128,
    "seq_len": 2048,
    "num_heads": 32,
    "head_dim": 64,
    "time_ms": 0.4454
  },
  {
    "config": "w16_s1_m128_n128",
    "num_warps": 16,
    "num_stages": 1,
    "BLOCK_M": 128,
    "BLOCK_N": 128,
    "seq_len": 2048,
    "num_heads": 32,
    "head_dim": 64,
    "time_ms": 0.2164
  },
  {
    "config": "w16_s2_m64_n64",
    "num_warps": 16,
    "num_stages": 2,
    "BLOCK_M": 64,
    "BLOCK_N": 64,
    "seq_len": 2048,
    "num_heads": 32,
    "head_dim": 64,
    "time_ms": 0.4452
  },
  {
    "config": "w16_s2_m64_n128",
    "num_warps": 16,
    "num_stages": 2,
    "BLOCK_M": 64,
    "BLOCK_N": 128,
    "seq_len": 2048,
    "num_heads": 32,
    "head_dim": 64,
    "time_ms": 0.3436
  },
  {
    "config": "w16_s2_m128_n128",
    "num_warps": 16,
    "num_stages": 2,
    "BLOCK_M": 128,
    "BLOCK_N": 128,
    "seq_len": 2048,
    "num_heads": 32,
    "head_dim": 64,
    "time_ms": 0.2094
  },
  {
    "config": "w16_s3_m64_n64",
    "num_warps": 16,
    "num_stages": 3,
    "BLOCK_M": 64,
    "BLOCK_N": 64,
    "seq_len": 2048,
    "num_heads": 32,
    "head_dim": 64,
    "time_ms": 0.4182
  },
  {
    "config": "w16_s3_m64_n128",
    "num_warps": 16,
    "num_stages": 3,
    "BLOCK_M": 64,
    "BLOCK_N": 128,
    "seq_len": 2048,
    "num_heads": 32,
    "head_dim": 64,
    "time_ms": 0.3252
  },
  {
    "config": "w16_s3_m128_n128",
    "num_warps": 16,
    "num_stages": 3,
    "BLOCK_M": 128,
    "BLOCK_N": 128,
    "seq_len": 2048,
    "num_heads": 32,
    "head_dim": 64,
    "time_ms": 0.1986
  },
  {
    "config": "w4_s1_m64_n64",
    "num_warps": 4,
    "num_stages": 1,
    "BLOCK_M": 64,
    "BLOCK_N": 64,
    "seq_len": 2048,
    "num_heads": 32,
    "head_dim": 128,
    "time_ms": 0.2249
  },
  {
    "config": "w4_s1_m64_n128",
    "num_warps": 4,
    "num_stages": 1,
    "BLOCK_M": 64,
    "BLOCK_N": 128,
    "seq_len": 2048,
    "num_heads": 32,
    "head_dim": 128,
    "time_ms": 0.2174
  },
  {
    "config": "w4_s1_m128_n128",
    "num_warps": 4,
    "num_stages": 1,
    "BLOCK_M": 128,
    "BLOCK_N": 128,
    "seq_len": 2048,
    "num_heads": 32,
    "head_dim": 128,
    "time_ms": 0.4571
  },
  {
    "config": "w4_s2_m64_n64",
    "num_warps": 4,
    "num_stages": 2,
    "BLOCK_M": 64,
    "BLOCK_N": 64,
    "seq_len": 2048,
    "num_heads": 32,
    "head_dim": 128,
    "time_ms": 0.2044
  },
  {
    "config": "w4_s2_m64_n128",
    "num_warps": 4,
    "num_stages": 2,
    "BLOCK_M": 64,
    "BLOCK_N": 128,
    "seq_len": 2048,
    "num_heads": 32,
    "head_dim": 128,
    "time_ms": 0.2985
  },
  {
    "config": "w4_s2_m128_n128",
    "num_warps": 4,
    "num_stages": 2,
    "BLOCK_M": 128,
    "BLOCK_N": 128,
    "seq_len": 2048,
    "num_heads": 32,
    "head_dim": 128,
    "time_ms": 0.4447
  },
  {
    "config": "w4_s3_m64_n64",
    "num_warps": 4,
    "num_stages": 3,
    "BLOCK_M": 64,
    "BLOCK_N": 64,
    "seq_len": 2048,
    "num_heads": 32,
    "head_dim": 128,
    "time_ms": 0.1873
  },
  {
    "config": "w4_s3_m64_n128",
    "num_warps": 4,
    "num_stages": 3,
    "BLOCK_M": 64,
    "BLOCK_N": 128,
    "seq_len": 2048,
    "num_heads": 32,
    "head_dim": 128,
    "time_ms": 0.3186
  },
  {
    "config": "w4_s3_m128_n128",
    "num_warps": 4,
    "num_stages": 3,
    "BLOCK_M": 128,
    "BLOCK_N": 128,
    "seq_len": 2048,
    "num_heads": 32,
    "head_dim": 128,
    "time_ms": 0.4358
  },
  {
    "config": "w8_s1_m64_n64",
    "num_warps": 8,
    "num_stages": 1,
    "BLOCK_M": 64,
    "BLOCK_N": 64,
    "seq_len": 2048,
    "num_heads": 32,
    "head_dim": 128,
    "time_ms": 0.2587
  },
  {
    "config": "w8_s1_m64_n128",
    "num_warps": 8,
    "num_stages": 1,
    "BLOCK_M": 64,
    "BLOCK_N": 128,
    "seq_len": 2048,
    "num_heads": 32,
    "head_dim": 128,
    "time_ms": 0.292
  },
  {
    "config": "w8_s1_m128_n128",
    "num_warps": 8,
    "num_stages": 1,
    "BLOCK_M": 128,
    "BLOCK_N": 128,
    "seq_len": 2048,
    "num_heads": 32,
    "head_dim": 128,
    "time_ms": 0.2288
  },
  {
    "config": "w8_s2_m64_n64",
    "num_warps": 8,
    "num_stages": 2,
    "BLOCK_M": 64,
    "BLOCK_N": 64,
    "seq_len": 2048,
    "num_heads": 32,
    "head_dim": 128,
    "time_ms": 0.241
  },
  {
    "config": "w8_s2_m64_n128",
    "num_warps": 8,
    "num_stages": 2,
    "BLOCK_M": 64,
    "BLOCK_N": 128,
    "seq_len": 2048,
    "num_heads": 32,
    "head_dim": 128,
    "time_ms": 0.2547
  },
  {
    "config": "w8_s2_m128_n128",
    "num_warps": 8,
    "num_stages": 2,
    "BLOCK_M": 128,
    "BLOCK_N": 128,
    "seq_len": 2048,
    "num_heads": 32,
    "head_dim": 128,
    "time_ms": 0.2356
  },
  {
    "config": "w8_s3_m64_n64",
    "num_warps": 8,
    "num_stages": 3,
    "BLOCK_M": 64,
    "BLOCK_N": 64,
    "seq_len": 2048,
    "num_heads": 32,
    "head_dim": 128,
    "time_ms": 0.2331
  },
  {
    "config": "w8_s3_m64_n128",
    "num_warps": 8,
    "num_stages": 3,
    "BLOCK_M": 64,
    "BLOCK_N": 128,
    "seq_len": 2048,
    "num_heads": 32,
    "head_dim": 128,
    "time_ms": 0.2355
  },
  {
    "config": "w8_s3_m128_n128",
    "num_warps": 8,
    "num_stages": 3,
    "BLOCK_M": 128,
    "BLOCK_N": 128,
    "seq_len": 2048,
    "num_heads": 32,
    "head_dim": 128,
    "time_ms": 0.2196
  },
  {
    "config": "w16_s1_m64_n64",
    "num_warps": 16,
    "num_stages": 1,
    "BLOCK_M": 64,
    "BLOCK_N": 64,
    "seq_len": 2048,
    "num_heads": 32,
    "head_dim": 128,
    "time_ms": 0.5625
  },
  {
    "config": "w16_s1_m64_n128",
    "num_warps": 16,
    "num_stages": 1,
    "BLOCK_M": 64,
    "BLOCK_N": 128,
    "seq_len": 2048,
    "num_heads": 32,
    "head_dim": 128,
    "time_ms": 0.51
  },
  {
    "config": "w16_s1_m128_n128",
    "num_warps": 16,
    "num_stages": 1,
    "BLOCK_M": 128,
    "BLOCK_N": 128,
    "seq_len": 2048,
    "num_heads": 32,
    "head_dim": 128,
    "time_ms": 0.3475
  },
  {
    "config": "w16_s2_m64_n64",
    "num_warps": 16,
    "num_stages": 2,
    "BLOCK_M": 64,
    "BLOCK_N": 64,
    "seq_len": 2048,
    "num_heads": 32,
    "head_dim": 128,
    "time_ms": 0.5569
  },
  {
    "config": "w16_s2_m64_n128",
    "num_warps": 16,
    "num_stages": 2,
    "BLOCK_M": 64,
    "BLOCK_N": 128,
    "seq_len": 2048,
    "num_heads": 32,
    "head_dim": 128,
    "time_ms": 0.4308
  },
  {
    "config": "w16_s2_m128_n128",
    "num_warps": 16,
    "num_stages": 2,
    "BLOCK_M": 128,
    "BLOCK_N": 128,
    "seq_len": 2048,
    "num_heads": 32,
    "head_dim": 128,
    "time_ms": 0.2726
  },
  {
    "config": "w16_s3_m64_n64",
    "num_warps": 16,
    "num_stages": 3,
    "BLOCK_M": 64,
    "BLOCK_N": 64,
    "seq_len": 2048,
    "num_heads": 32,
    "head_dim": 128,
    "time_ms": 0.5229
  },
  {
    "config": "w16_s3_m64_n128",
    "num_warps": 16,
    "num_stages": 3,
    "BLOCK_M": 64,
    "BLOCK_N": 128,
    "seq_len": 2048,
    "num_heads": 32,
    "head_dim": 128,
    "time_ms": 0.4102
  },
  {
    "config": "w16_s3_m128_n128",
    "num_warps": 16,
    "num_stages": 3,
    "BLOCK_M": 128,
    "BLOCK_N": 128,
    "seq_len": 2048,
    "num_heads": 32,
    "head_dim": 128,
    "time_ms": 0.2639
  },
  {
    "config": "w4_s1_m64_n64",
    "num_warps": 4,
    "num_stages": 1,
    "BLOCK_M": 64,
    "BLOCK_N": 64,
    "seq_len": 8192,
    "num_heads": 4,
    "head_dim": 64,
    "time_ms": 0.2613
  },
  {
    "config": "w4_s1_m64_n128",
    "num_warps": 4,
    "num_stages": 1,
    "BLOCK_M": 64,
    "BLOCK_N": 128,
    "seq_len": 8192,
    "num_heads": 4,
    "head_dim": 64,
    "time_ms": 0.2757
  },
  {
    "config": "w4_s1_m128_n128",
    "num_warps": 4,
    "num_stages": 1,
    "BLOCK_M": 128,
    "BLOCK_N": 128,
    "seq_len": 8192,
    "num_heads": 4,
    "head_dim": 64,
    "time_ms": 0.5289
  },
  {
    "config": "w4_s2_m64_n64",
    "num_warps": 4,
    "num_stages": 2,
    "BLOCK_M": 64,
    "BLOCK_N": 64,
    "seq_len": 8192,
    "num_heads": 4,
    "head_dim": 64,
    "time_ms": 0.2432
  },
  {
    "config": "w4_s2_m64_n128",
    "num_warps": 4,
    "num_stages": 2,
    "BLOCK_M": 64,
    "BLOCK_N": 128,
    "seq_len": 8192,
    "num_heads": 4,
    "head_dim": 64,
    "time_ms": 0.223
  },
  {
    "config": "w4_s2_m128_n128",
    "num_warps": 4,
    "num_stages": 2,
    "BLOCK_M": 128,
    "BLOCK_N": 128,
    "seq_len": 8192,
    "num_heads": 4,
    "head_dim": 64,
    "time_ms": 0.4734
  },
  {
    "config": "w4_s3_m64_n64",
    "num_warps": 4,
    "num_stages": 3,
    "BLOCK_M": 64,
    "BLOCK_N": 64,
    "seq_len": 8192,
    "num_heads": 4,
    "head_dim": 64,
    "time_ms": 0.2306
  },
  {
    "config": "w4_s3_m64_n128",
    "num_warps": 4,
    "num_stages": 3,
    "BLOCK_M": 64,
    "BLOCK_N": 128,
    "seq_len": 8192,
    "num_heads": 4,
    "head_dim": 64,
    "time_ms": 0.2097
  },
  {
    "config": "w4_s3_m128_n128",
    "num_warps": 4,
    "num_stages": 3,
    "BLOCK_M": 128,
    "BLOCK_N": 128,
    "seq_len": 8192,
    "num_heads": 4,
    "head_dim": 64,
    "time_ms": 0.4639
  },
  {
    "config": "w8_s1_m64_n64",
    "num_warps": 8,
    "num_stages": 1,
    "BLOCK_M": 64,
    "BLOCK_N": 64,
    "seq_len": 8192,
    "num_heads": 4,
    "head_dim": 64,
    "time_ms": 0.4146
  },
  {
    "config": "w8_s1_m64_n128",
    "num_warps": 8,
    "num_stages": 1,
    "BLOCK_M": 64,
    "BLOCK_N": 128,
    "seq_len": 8192,
    "num_heads": 4,
    "head_dim": 64,
    "time_ms": 0.4529
  },
  {
    "config": "w8_s1_m128_n128",
    "num_warps": 8,
    "num_stages": 1,
    "BLOCK_M": 128,
    "BLOCK_N": 128,
    "seq_len": 8192,
    "num_heads": 4,
    "head_dim": 64,
    "time_ms": 0.3009
  },
  {
    "config": "w8_s2_m64_n64",
    "num_warps": 8,
    "num_stages": 2,
    "BLOCK_M": 64,
    "BLOCK_N": 64,
    "seq_len": 8192,
    "num_heads": 4,
    "head_dim": 64,
    "time_ms": 0.4113
  },
  {
    "config": "w8_s2_m64_n128",
    "num_warps": 8,
    "num_stages": 2,
    "BLOCK_M": 64,
    "BLOCK_N": 128,
    "seq_len": 8192,
    "num_heads": 4,
    "head_dim": 64,
    "time_ms": 0.4289
  },
  {
    "config": "w8_s2_m128_n128",
    "num_warps": 8,
    "num_stages": 2,
    "BLOCK_M": 128,
    "BLOCK_N": 128,
    "seq_len": 8192,
    "num_heads": 4,
    "head_dim": 64,
    "time_ms": 0.2613
  },
  {
    "config": "w8_s3_m64_n64",
    "num_warps": 8,
    "num_stages": 3,
    "BLOCK_M": 64,
    "BLOCK_N": 64,
    "seq_len": 8192,
    "num_heads": 4,
    "head_dim": 64,
    "time_ms": 0.3863
  },
  {
    "config": "w8_s3_m64_n128",
    "num_warps": 8,
    "num_stages": 3,
    "BLOCK_M": 64,
    "BLOCK_N": 128,
    "seq_len": 8192,
    "num_heads": 4,
    "head_dim": 64,
    "time_ms": 0.4042
  },
  {
    "config": "w8_s3_m128_n128",
    "num_warps": 8,
    "num_stages": 3,
    "BLOCK_M": 128,
    "BLOCK_N": 128,
    "seq_len": 8192,
    "num_heads": 4,
    "head_dim": 64,
    "time_ms": 0.2439
  },
  {
    "config": "w16_s1_m64_n64",
    "num_warps": 16,
    "num_stages": 1,
    "BLOCK_M": 64,
    "BLOCK_N": 64,
    "seq_len": 8192,
    "num_heads": 4,
    "head_dim": 64,
    "time_ms": 0.8393
  },
  {
    "config": "w16_s1_m64_n128",
    "num_warps": 16,
    "num_stages": 1,
    "BLOCK_M": 64,
    "BLOCK_N": 128,
    "seq_len": 8192,
    "num_heads": 4,
    "head_dim": 64,
    "time_ms": 0.9378
  },
  {
    "config": "w16_s1_m128_n128",
    "num_warps": 16,
    "num_stages": 1,
    "BLOCK_M": 128,
    "BLOCK_N": 128,
    "seq_len": 8192,
    "num_heads": 4,
    "head_dim": 64,
    "time_ms": 0.4878
  },
  {
    "config": "w16_s2_m64_n64",
    "num_warps": 16,
    "num_stages": 2,
    "BLOCK_M": 64,
    "BLOCK_N": 64,
    "seq_len": 8192,
    "num_heads": 4,
    "head_dim": 64,
    "time_ms": 0.9248
  },
  {
    "config": "w16_s2_m64_n128",
    "num_warps": 16,
    "num_stages": 2,
    "BLOCK_M": 64,
    "BLOCK_N": 128,
    "seq_len": 8192,
    "num_heads": 4,
    "head_dim": 64,
    "time_ms": 0.7146
  },
  {
    "config": "w16_s2_m128_n128",
    "num_warps": 16,
    "num_stages": 2,
    "BLOCK_M": 128,
    "BLOCK_N": 128,
    "seq_len": 8192,
    "num_heads": 4,
    "head_dim": 64,
    "time_ms": 0.4534
  },
  {
    "config": "w16_s3_m64_n64",
    "num_warps": 16,
    "num_stages": 3,
    "BLOCK_M": 64,
    "BLOCK_N": 64,
    "seq_len": 8192,
    "num_heads": 4,
    "head_dim": 64,
    "time_ms": 0.8711
  },
  {
    "config": "w16_s3_m64_n128",
    "num_warps": 16,
    "num_stages": 3,
    "BLOCK_M": 64,
    "BLOCK_N": 128,
    "seq_len": 8192,
    "num_heads": 4,
    "head_dim": 64,
    "time_ms": 0.6731
  },
  {
    "config": "w16_s3_m128_n128",
    "num_warps": 16,
    "num_stages": 3,
    "BLOCK_M": 128,
    "BLOCK_N": 128,
    "seq_len": 8192,
    "num_heads": 4,
    "head_dim": 64,
    "time_ms": 0.4329
  },
  {
    "config": "w4_s1_m64_n64",
    "num_warps": 4,
    "num_stages": 1,
    "BLOCK_M": 64,
    "BLOCK_N": 64,
    "seq_len": 8192,
    "num_heads": 4,
    "head_dim": 128,
    "time_ms": 0.4882
  },
  {
    "config": "w4_s1_m64_n128",
    "num_warps": 4,
    "num_stages": 1,
    "BLOCK_M": 64,
    "BLOCK_N": 128,
    "seq_len": 8192,
    "num_heads": 4,
    "head_dim": 128,
    "time_ms": 0.455
  },
  {
    "config": "w4_s1_m128_n128",
    "num_warps": 4,
    "num_stages": 1,
    "BLOCK_M": 128,
    "BLOCK_N": 128,
    "seq_len": 8192,
    "num_heads": 4,
    "head_dim": 128,
    "time_ms": 0.8886
  },
  {
    "config": "w4_s2_m64_n64",
    "num_warps": 4,
    "num_stages": 2,
    "BLOCK_M": 64,
    "BLOCK_N": 64,
    "seq_len": 8192,
    "num_heads": 4,
    "head_dim": 128,
    "time_ms": 0.4399
  },
  {
    "config": "w4_s2_m64_n128",
    "num_warps": 4,
    "num_stages": 2,
    "BLOCK_M": 64,
    "BLOCK_N": 128,
    "seq_len": 8192,
    "num_heads": 4,
    "head_dim": 128,
    "time_ms": 0.5889
  },
  {
    "config": "w4_s2_m128_n128",
    "num_warps": 4,
    "num_stages": 2,
    "BLOCK_M": 128,
    "BLOCK_N": 128,
    "seq_len": 8192,
    "num_heads": 4,
    "head_dim": 128,
    "time_ms": 0.9757
  },
  {
    "config": "w4_s3_m64_n64",
    "num_warps": 4,
    "num_stages": 3,
    "BLOCK_M": 64,
    "BLOCK_N": 64,
    "seq_len": 8192,
    "num_heads": 4,
    "head_dim": 128,
    "time_ms": 0.3941
  },
  {
    "config": "w4_s3_m64_n128",
    "num_warps": 4,
    "num_stages": 3,
    "BLOCK_M": 64,
    "BLOCK_N": 128,
    "seq_len": 8192,
    "num_heads": 4,
    "head_dim": 128,
    "time_ms": 0.6352
  },
  {
    "config": "w4_s3_m128_n128",
    "num_warps": 4,
    "num_stages": 3,
    "BLOCK_M": 128,
    "BLOCK_N": 128,
    "seq_len": 8192,
    "num_heads": 4,
    "head_dim": 128,
    "time_ms": 0.9586
  },
  {
    "config": "w8_s1_m64_n64",
    "num_warps": 8,
    "num_stages": 1,
    "BLOCK_M": 64,
    "BLOCK_N": 64,
    "seq_len": 8192,
    "num_heads": 4,
    "head_dim": 128,
    "time_ms": 0.552
  },
  {
    "config": "w8_s1_m64_n128",
    "num_warps": 8,
    "num_stages": 1,
    "BLOCK_M": 64,
    "BLOCK_N": 128,
    "seq_len": 8192,
    "num_heads": 4,
    "head_dim": 128,
    "time_ms": 0.6031
  },
  {
    "config": "w8_s1_m128_n128",
    "num_warps": 8,
    "num_stages": 1,
    "BLOCK_M": 128,
    "BLOCK_N": 128,
    "seq_len": 8192,
    "num_heads": 4,
    "head_dim": 128,
    "time_ms": 0.4948
  },
  {
    "config": "w8_s2_m64_n64",
    "num_warps": 8,
    "num_stages": 2,
    "BLOCK_M": 64,
    "BLOCK_N": 64,
    "seq_len": 8192,
    "num_heads": 4,
    "head_dim": 128,
    "time_ms": 0.5103
  },
  {
    "config": "w8_s2_m64_n128",
    "num_warps": 8,
    "num_stages": 2,
    "BLOCK_M": 64,
    "BLOCK_N": 128,
    "seq_len": 8192,
    "num_heads": 4,
    "head_dim": 128,
    "time_ms": 0.5036
  },
  {
    "config": "w8_s2_m128_n128",
    "num_warps": 8,
    "num_stages": 2,
    "BLOCK_M": 128,
    "BLOCK_N": 128,
    "seq_len": 8192,
    "num_heads": 4,
    "head_dim": 128,
    "time_ms": 0.5016
  },
  {
    "config": "w8_s3_m64_n64",
    "num_warps": 8,
    "num_stages": 3,
    "BLOCK_M": 64,
    "BLOCK_N": 64,
    "seq_len": 8192,
    "num_heads": 4,
    "head_dim": 128,
    "time_ms": 0.493
  },
  {
    "config": "w8_s3_m64_n128",
    "num_warps": 8,
    "num_stages": 3,
    "BLOCK_M": 64,
    "BLOCK_N": 128,
    "seq_len": 8192,
    "num_heads": 4,
    "head_dim": 128,
    "time_ms": 0.4645
  },
  {
    "config": "w8_s3_m128_n128",
    "num_warps": 8,
    "num_stages": 3,
    "BLOCK_M": 128,
    "BLOCK_N": 128,
    "seq_len": 8192,
    "num_heads": 4,
    "head_dim": 128,
    "time_ms": 0.4654
  },
  {
    "config": "w16_s1_m64_n64",
    "num_warps": 16,
    "num_stages": 1,
    "BLOCK_M": 64,
    "BLOCK_N": 64,
    "seq_len": 8192,
    "num_heads": 4,
    "head_dim": 128,
    "time_ms": 1.1827
  },
  {
    "config": "w16_s1_m64_n128",
    "num_warps": 16,
    "num_stages": 1,
    "BLOCK_M": 64,
    "BLOCK_N": 128,
    "seq_len": 8192,
    "num_heads": 4,
    "head_dim": 128,
    "time_ms": 1.0613
  },
  {
    "config": "w16_s1_m128_n128",
    "num_warps": 16,
    "num_stages": 1,
    "BLOCK_M": 128,
    "BLOCK_N": 128,
    "seq_len": 8192,
    "num_heads": 4,
    "head_dim": 128,
    "time_ms": 0.7543
  },
  {
    "config": "w16_s2_m64_n64",
    "num_warps": 16,
    "num_stages": 2,
    "BLOCK_M": 64,
    "BLOCK_N": 64,
    "seq_len": 8192,
    "num_heads": 4,
    "head_dim": 128,
    "time_ms": 1.1575
  },
  {
    "config": "w16_s2_m64_n128",
    "num_warps": 16,
    "num_stages": 2,
    "BLOCK_M": 64,
    "BLOCK_N": 128,
    "seq_len": 8192,
    "num_heads": 4,
    "head_dim": 128,
    "time_ms": 0.8725
  },
  {
    "config": "w16_s2_m128_n128",
    "num_warps": 16,
    "num_stages": 2,
    "BLOCK_M": 128,
    "BLOCK_N": 128,
    "seq_len": 8192,
    "num_heads": 4,
    "head_dim": 128,
    "time_ms": 0.6001
  },
  {
    "config": "w16_s3_m64_n64",
    "num_warps": 16,
    "num_stages": 3,
    "BLOCK_M": 64,
    "BLOCK_N": 64,
    "seq_len": 8192,
    "num_heads": 4,
    "head_dim": 128,
    "time_ms": 1.0945
  },
  {
    "config": "w16_s3_m64_n128",
    "num_warps": 16,
    "num_stages": 3,
    "BLOCK_M": 64,
    "BLOCK_N": 128,
    "seq_len": 8192,
    "num_heads": 4,
    "head_dim": 128,
    "time_ms": 0.8428
  },
  {
    "config": "w16_s3_m128_n128",
    "num_warps": 16,
    "num_stages": 3,
    "BLOCK_M": 128,
    "BLOCK_N": 128,
    "seq_len": 8192,
    "num_heads": 4,
    "head_dim": 128,
    "time_ms": 0.5838
  },
  {
    "config": "w4_s1_m64_n64",
    "num_warps": 4,
    "num_stages": 1,
    "BLOCK_M": 64,
    "BLOCK_N": 64,
    "seq_len": 8192,
    "num_heads": 32,
    "head_dim": 64,
    "time_ms": 1.3958
  },
  {
    "config": "w4_s1_m64_n128",
    "num_warps": 4,
    "num_stages": 1,
    "BLOCK_M": 64,
    "BLOCK_N": 128,
    "seq_len": 8192,
    "num_heads": 32,
    "head_dim": 64,
    "time_ms": 1.6981
  },
  {
    "config": "w4_s1_m128_n128",
    "num_warps": 4,
    "num_stages": 1,
    "BLOCK_M": 128,
    "BLOCK_N": 128,
    "seq_len": 8192,
    "num_heads": 32,
    "head_dim": 64,
    "time_ms": 2.6211
  },
  {
    "config": "w4_s2_m64_n64",
    "num_warps": 4,
    "num_stages": 2,
    "BLOCK_M": 64,
    "BLOCK_N": 64,
    "seq_len": 8192,
    "num_heads": 32,
    "head_dim": 64,
    "time_ms": 1.3179
  },
  {
    "config": "w4_s2_m64_n128",
    "num_warps": 4,
    "num_stages": 2,
    "BLOCK_M": 64,
    "BLOCK_N": 128,
    "seq_len": 8192,
    "num_heads": 32,
    "head_dim": 64,
    "time_ms": 1.3742
  },
  {
    "config": "w4_s2_m128_n128",
    "num_warps": 4,
    "num_stages": 2,
    "BLOCK_M": 128,
    "BLOCK_N": 128,
    "seq_len": 8192,
    "num_heads": 32,
    "head_dim": 64,
    "time_ms": 2.178
  },
  {
    "config": "w4_s3_m64_n64",
    "num_warps": 4,
    "num_stages": 3,
    "BLOCK_M": 64,
    "BLOCK_N": 64,
    "seq_len": 8192,
    "num_heads": 32,
    "head_dim": 64,
    "time_ms": 1.3035
  },
  {
    "config": "w4_s3_m64_n128",
    "num_warps": 4,
    "num_stages": 3,
    "BLOCK_M": 64,
    "BLOCK_N": 128,
    "seq_len": 8192,
    "num_heads": 32,
    "head_dim": 64,
    "time_ms": 1.3063
  },
  {
    "config": "w4_s3_m128_n128",
    "num_warps": 4,
    "num_stages": 3,
    "BLOCK_M": 128,
    "BLOCK_N": 128,
    "seq_len": 8192,
    "num_heads": 32,
    "head_dim": 64,
    "time_ms": 2.1074
  },
  {
    "config": "w8_s1_m64_n64",
    "num_warps": 8,
    "num_stages": 1,
    "BLOCK_M": 64,
    "BLOCK_N": 64,
    "seq_len": 8192,
    "num_heads": 32,
    "head_dim": 64,
    "time_ms": 2.5559
  },
  {
    "config": "w8_s1_m64_n128",
    "num_warps": 8,
    "num_stages": 1,
    "BLOCK_M": 64,
    "BLOCK_N": 128,
    "seq_len": 8192,
    "num_heads": 32,
    "head_dim": 64,
    "time_ms": 3.0451
  },
  {
    "config": "w8_s1_m128_n128",
    "num_warps": 8,
    "num_stages": 1,
    "BLOCK_M": 128,
    "BLOCK_N": 128,
    "seq_len": 8192,
    "num_heads": 32,
    "head_dim": 64,
    "time_ms": 1.7139
  },
  {
    "config": "w8_s2_m64_n64",
    "num_warps": 8,
    "num_stages": 2,
    "BLOCK_M": 64,
    "BLOCK_N": 64,
    "seq_len": 8192,
    "num_heads": 32,
    "head_dim": 64,
    "time_ms": 2.567
  },
  {
    "config": "w8_s2_m64_n128",
    "num_warps": 8,
    "num_stages": 2,
    "BLOCK_M": 64,
    "BLOCK_N": 128,
    "seq_len": 8192,
    "num_heads": 32,
    "head_dim": 64,
    "time_ms": 2.9596
  },
  {
    "config": "w8_s2_m128_n128",
    "num_warps": 8,
    "num_stages": 2,
    "BLOCK_M": 128,
    "BLOCK_N": 128,
    "seq_len": 8192,
    "num_heads": 32,
    "head_dim": 64,
    "time_ms": 1.5158
  },
  {
    "config": "w8_s3_m64_n64",
    "num_warps": 8,
    "num_stages": 3,
    "BLOCK_M": 64,
    "BLOCK_N": 64,
    "seq_len": 8192,
    "num_heads": 32,
    "head_dim": 64,
    "time_ms": 2.3315
  },
  {
    "config": "w8_s3_m64_n128",
    "num_warps": 8,
    "num_stages": 3,
    "BLOCK_M": 64,
    "BLOCK_N": 128,
    "seq_len": 8192,
    "num_heads": 32,
    "head_dim": 64,
    "time_ms": 2.4909
  },
  {
    "config": "w8_s3_m128_n128",
    "num_warps": 8,
    "num_stages": 3,
    "BLOCK_M": 128,
    "BLOCK_N": 128,
    "seq_len": 8192,
    "num_heads": 32,
    "head_dim": 64,
    "time_ms": 1.2781
  },
  {
    "config": "w16_s1_m64_n64",
    "num_warps": 16,
    "num_stages": 1,
    "BLOCK_M": 64,
    "BLOCK_N": 64,
    "seq_len": 8192,
    "num_heads": 32,
    "head_dim": 64,
    "time_ms": 5.7801
  },
  {
    "config": "w16_s1_m64_n128",
    "num_warps": 16,
    "num_stages": 1,
    "BLOCK_M": 64,
    "BLOCK_N": 128,
    "seq_len": 8192,
    "num_heads": 32,
    "head_dim": 64,
    "time_ms": 6.2483
  },
  {
    "config": "w16_s1_m128_n128",
    "num_warps": 16,
    "num_stages": 1,
    "BLOCK_M": 128,
    "BLOCK_N": 128,
    "seq_len": 8192,
    "num_heads": 32,
    "head_dim": 64,
    "time_ms": 2.7334
  },
  {
    "config": "w16_s2_m64_n64",
    "num_warps": 16,
    "num_stages": 2,
    "BLOCK_M": 64,
    "BLOCK_N": 64,
    "seq_len": 8192,
    "num_heads": 32,
    "head_dim": 64,
    "time_ms": 6.4425
  },
  {
    "config": "w16_s2_m64_n128",
    "num_warps": 16,
    "num_stages": 2,
    "BLOCK_M": 64,
    "BLOCK_N": 128,
    "seq_len": 8192,
    "num_heads": 32,
    "head_dim": 64,
    "time_ms": 4.8796
  },
  {
    "config": "w16_s2_m128_n128",
    "num_warps": 16,
    "num_stages": 2,
    "BLOCK_M": 128,
    "BLOCK_N": 128,
    "seq_len": 8192,
    "num_heads": 32,
    "head_dim": 64,
    "time_ms": 2.5934
  },
  {
    "config": "w16_s3_m64_n64",
    "num_warps": 16,
    "num_stages": 3,
    "BLOCK_M": 64,
    "BLOCK_N": 64,
    "seq_len": 8192,
    "num_heads": 32,
    "head_dim": 64,
    "time_ms": 5.6515
  },
  {
    "config": "w16_s3_m64_n128",
    "num_warps": 16,
    "num_stages": 3,
    "BLOCK_M": 64,
    "BLOCK_N": 128,
    "seq_len": 8192,
    "num_heads": 32,
    "head_dim": 64,
    "time_ms": 4.3498
  },
  {
    "config": "w16_s3_m128_n128",
    "num_warps": 16,
    "num_stages": 3,
    "BLOCK_M": 128,
    "BLOCK_N": 128,
    "seq_len": 8192,
    "num_heads": 32,
    "head_dim": 64,
    "time_ms": 2.3609
  },
  {
    "config": "w4_s1_m64_n64",
    "num_warps": 4,
    "num_stages": 1,
    "BLOCK_M": 64,
    "BLOCK_N": 64,
    "seq_len": 8192,
    "num_heads": 32,
    "head_dim": 128,
    "time_ms": 3.023
  },
  {
    "config": "w4_s1_m64_n128",
    "num_warps": 4,
    "num_stages": 1,
    "BLOCK_M": 64,
    "BLOCK_N": 128,
    "seq_len": 8192,
    "num_heads": 32,
    "head_dim": 128,
    "time_ms": 2.8163
  },
  {
    "config": "w4_s1_m128_n128",
    "num_warps": 4,
    "num_stages": 1,
    "BLOCK_M": 128,
    "BLOCK_N": 128,
    "seq_len": 8192,
    "num_heads": 32,
    "head_dim": 128,
    "time_ms": 6.0439
  },
  {
    "config": "w4_s2_m64_n64",
    "num_warps": 4,
    "num_stages": 2,
    "BLOCK_M": 64,
    "BLOCK_N": 64,
    "seq_len": 8192,
    "num_heads": 32,
    "head_dim": 128,
    "time_ms": 2.7382
  },
  {
    "config": "w4_s2_m64_n128",
    "num_warps": 4,
    "num_stages": 2,
    "BLOCK_M": 64,
    "BLOCK_N": 128,
    "seq_len": 8192,
    "num_heads": 32,
    "head_dim": 128,
    "time_ms": 4.1599
  },
  {
    "config": "w4_s2_m128_n128",
    "num_warps": 4,
    "num_stages": 2,
    "BLOCK_M": 128,
    "BLOCK_N": 128,
    "seq_len": 8192,
    "num_heads": 32,
    "head_dim": 128,
    "time_ms": 5.8492
  },
  {
    "config": "w4_s3_m64_n64",
    "num_warps": 4,
    "num_stages": 3,
    "BLOCK_M": 64,
    "BLOCK_N": 64,
    "seq_len": 8192,
    "num_heads": 32,
    "head_dim": 128,
    "time_ms": 2.5478
  },
  {
    "config": "w4_s3_m64_n128",
    "num_warps": 4,
    "num_stages": 3,
    "BLOCK_M": 64,
    "BLOCK_N": 128,
    "seq_len": 8192,
    "num_heads": 32,
    "head_dim": 128,
    "time_ms": 4.1082
  },
  {
    "config": "w4_s3_m128_n128",
    "num_warps": 4,
    "num_stages": 3,
    "BLOCK_M": 128,
    "BLOCK_N": 128,
    "seq_len": 8192,
    "num_heads": 32,
    "head_dim": 128,
    "time_ms": 5.6447
  },
  {
    "config": "w8_s1_m64_n64",
    "num_warps": 8,
    "num_stages": 1,
    "BLOCK_M": 64,
    "BLOCK_N": 64,
    "seq_len": 8192,
    "num_heads": 32,
    "head_dim": 128,
    "time_ms": 3.4979
  },
  {
    "config": "w8_s1_m64_n128",
    "num_warps": 8,
    "num_stages": 1,
    "BLOCK_M": 64,
    "BLOCK_N": 128,
    "seq_len": 8192,
    "num_heads": 32,
    "head_dim": 128,
    "time_ms": 4.0688
  },
  {
    "config": "w8_s1_m128_n128",
    "num_warps": 8,
    "num_stages": 1,
    "BLOCK_M": 128,
    "BLOCK_N": 128,
    "seq_len": 8192,
    "num_heads": 32,
    "head_dim": 128,
    "time_ms": 2.8707
  },
  {
    "config": "w8_s2_m64_n64",
    "num_warps": 8,
    "num_stages": 2,
    "BLOCK_M": 64,
    "BLOCK_N": 64,
    "seq_len": 8192,
    "num_heads": 32,
    "head_dim": 128,
    "time_ms": 3.3356
  },
  {
    "config": "w8_s2_m64_n128",
    "num_warps": 8,
    "num_stages": 2,
    "BLOCK_M": 64,
    "BLOCK_N": 128,
    "seq_len": 8192,
    "num_heads": 32,
    "head_dim": 128,
    "time_ms": 3.6676
  },
  {
    "config": "w8_s2_m128_n128",
    "num_warps": 8,
    "num_stages": 2,
    "BLOCK_M": 128,
    "BLOCK_N": 128,
    "seq_len": 8192,
    "num_heads": 32,
    "head_dim": 128,
    "time_ms": 2.9637
  },
  {
    "config": "w8_s3_m64_n64",
    "num_warps": 8,
    "num_stages": 3,
    "BLOCK_M": 64,
    "BLOCK_N": 64,
    "seq_len": 8192,
    "num_heads": 32,
    "head_dim": 128,
    "time_ms": 3.3579
  },
  {
    "config": "w8_s3_m64_n128",
    "num_warps": 8,
    "num_stages": 3,
    "BLOCK_M": 64,
    "BLOCK_N": 128,
    "seq_len": 8192,
    "num_heads": 32,
    "head_dim": 128,
    "time_ms": 3.2891
  },
  {
    "config": "w8_s3_m128_n128",
    "num_warps": 8,
    "num_stages": 3,
    "BLOCK_M": 128,
    "BLOCK_N": 128,
    "seq_len": 8192,
    "num_heads": 32,
    "head_dim": 128,
    "time_ms": 2.6808
  },
  {
    "config": "w16_s1_m64_n64",
    "num_warps": 16,
    "num_stages": 1,
    "BLOCK_M": 64,
    "BLOCK_N": 64,
    "seq_len": 8192,
    "num_heads": 32,
    "head_dim": 128,
    "time_ms": 7.7239
  },
  {
    "config": "w16_s1_m64_n128",
    "num_warps": 16,
    "num_stages": 1,
    "BLOCK_M": 64,
    "BLOCK_N": 128,
    "seq_len": 8192,
    "num_heads": 32,
    "head_dim": 128,
    "time_ms": 7.0631
  },
  {
    "config": "w16_s1_m128_n128",
    "num_warps": 16,
    "num_stages": 1,
    "BLOCK_M": 128,
    "BLOCK_N": 128,
    "seq_len": 8192,
    "num_heads": 32,
    "head_dim": 128,
    "time_ms": 4.5378
  },
  {
    "config": "w16_s2_m64_n64",
    "num_warps": 16,
    "num_stages": 2,
    "BLOCK_M": 64,
    "BLOCK_N": 64,
    "seq_len": 8192,
    "num_heads": 32,
    "head_dim": 128,
    "time_ms": 8.2199
  },
  {
    "config": "w16_s2_m64_n128",
    "num_warps": 16,
    "num_stages": 2,
    "BLOCK_M": 64,
    "BLOCK_N": 128,
    "seq_len": 8192,
    "num_heads": 32,
    "head_dim": 128,
    "time_ms": 6.036
  },
  {
    "config": "w16_s2_m128_n128",
    "num_warps": 16,
    "num_stages": 2,
    "BLOCK_M": 128,
    "BLOCK_N": 128,
    "seq_len": 8192,
    "num_heads": 32,
    "head_dim": 128,
    "time_ms": 3.4017
  },
  {
    "config": "w16_s3_m64_n64",
    "num_warps": 16,
    "num_stages": 3,
    "BLOCK_M": 64,
    "BLOCK_N": 64,
    "seq_len": 8192,
    "num_heads": 32,
    "head_dim": 128,
    "time_ms": 7.1618
  },
  {
    "config": "w16_s3_m64_n128",
    "num_warps": 16,
    "num_stages": 3,
    "BLOCK_M": 64,
    "BLOCK_N": 128,
    "seq_len": 8192,
    "num_heads": 32,
    "head_dim": 128,
    "time_ms": 5.6414
  },
  {
    "config": "w16_s3_m128_n128",
    "num_warps": 16,
    "num_stages": 3,
    "BLOCK_M": 128,
    "BLOCK_N": 128,
    "seq_len": 8192,
    "num_heads": 32,
    "head_dim": 128,
    "time_ms": 3.1758
  }
]