python/sglang/srt/lora/triton_ops/moe_shrink_configs/triton_3_6_0/moe_lora_shrink,E=384,N=64,K=7168,device_name=NVIDIA_B200.json
{
    "16": {
        "BLOCK_SIZE_M": 16,
        "GROUP_SIZE_M": 1,
        "num_warps": 4,
        "num_stages": 2,
        "SPLIT_K": 6
    },
    "32": {
        "BLOCK_SIZE_M": 16,
        "GROUP_SIZE_M": 1,
        "num_warps": 4,
        "num_stages": 2,
        "SPLIT_K": 4
    },
    "64": {
        "BLOCK_SIZE_M": 16,
        "GROUP_SIZE_M": 1,
        "num_warps": 4,
        "num_stages": 3,
        "SPLIT_K": 1
    },
    "2048": {
        "BLOCK_SIZE_M": 64,
        "GROUP_SIZE_M": 1,
        "num_warps": 4,
        "num_stages": 3,
        "SPLIT_K": 1
    }
}
