python/sglang/srt/lora/triton_ops/moe_shrink_configs/triton_3_6_0/moe_lora_shrink,E=384,N=64,K=7168,device_name=NVIDIA_B200.json
{
    "1": {
        "BLOCK_SIZE_M": 16,
        "num_warps": 4,
        "num_stages": 3,
        "SPLIT_K": 8
    },
    "2": {
        "BLOCK_SIZE_M": 16,
        "num_warps": 4,
        "num_stages": 3,
        "SPLIT_K": 8
    },
    "3": {
        "BLOCK_SIZE_M": 16,
        "num_warps": 4,
        "num_stages": 3,
        "SPLIT_K": 6
    },
    "4": {
        "BLOCK_SIZE_M": 16,
        "num_warps": 4,
        "num_stages": 4,
        "SPLIT_K": 4
    },
    "5": {
        "BLOCK_SIZE_M": 16,
        "num_warps": 4,
        "num_stages": 3,
        "SPLIT_K": 7
    },
    "6": {
        "BLOCK_SIZE_M": 16,
        "num_warps": 4,
        "num_stages": 3,
        "SPLIT_K": 6
    },
    "7": {
        "BLOCK_SIZE_M": 16,
        "num_warps": 4,
        "num_stages": 3,
        "SPLIT_K": 5
    },
    "8": {
        "BLOCK_SIZE_M": 16,
        "num_warps": 4,
        "num_stages": 3,
        "SPLIT_K": 4
    },
    "12": {
        "BLOCK_SIZE_M": 16,
        "num_warps": 4,
        "num_stages": 2,
        "SPLIT_K": 6
    },
    "16": {
        "BLOCK_SIZE_M": 16,
        "num_warps": 4,
        "num_stages": 3,
        "SPLIT_K": 2
    },
    "24": {
        "BLOCK_SIZE_M": 16,
        "num_warps": 4,
        "num_stages": 2,
        "SPLIT_K": 3
    },
    "32": {
        "BLOCK_SIZE_M": 16,
        "num_warps": 4,
        "num_stages": 3,
        "SPLIT_K": 1
    },
    "48": {
        "BLOCK_SIZE_M": 16,
        "num_warps": 4,
        "num_stages": 2,
        "SPLIT_K": 7
    },
    "64": {
        "BLOCK_SIZE_M": 16,
        "num_warps": 4,
        "num_stages": 2,
        "SPLIT_K": 7
    },
    "512": {
        "BLOCK_SIZE_M": 16,
        "num_warps": 4,
        "num_stages": 2,
        "SPLIT_K": 7
    },
    "1024": {
        "BLOCK_SIZE_M": 32,
        "num_warps": 4,
        "num_stages": 2,
        "SPLIT_K": 3
    },
    "2048": {
        "BLOCK_SIZE_M": 64,
        "num_warps": 4,
        "num_stages": 3,
        "SPLIT_K": 1
    },
    "4096": {
        "BLOCK_SIZE_M": 32,
        "num_warps": 2,
        "num_stages": 2,
        "SPLIT_K": 1
    }
}
